### ISSUE TITLE
[FEATURE] Backing image supports IPv6 and dual-stack IP families

### ISSUE THREAD

**Issue by COLDTURNIP** [longhorn/longhorn#13864]
### Is your feature request related to a problem? Please describe (👍 if you like this request)

BIM currently does not fully support dual-stack or IPv6 network.

- To storage network using IPv6, [it always try to serve with an IPv4 address](https://github.com/longhorn/backing-image-manager/blob/master/pkg/util/http_util.go#L71C42-L71C65).
- To dual-stack network, there is no handle for the preferred IP family.

### Describe the solution you'd like

BIM & BIDS should follow the IP family selecting logic (#13050) to serve the copy management and the RPC interface. And the following cases must be covered:

- single-stack IPv4: serve with IPv4 address
- single-stack IPv6: serve with IPv6 address
- dual-stack IPv4-first: serve with IPv4 address
- dual-stack IPv6-first: serve with IPv6 address
- IPv4 storage network: serve with IPv4 address
- IPv6 storage network: serve with IPv6 address

**Comment by COLDTURNIP** [comment]
## Verification Steps

1. Given a cluster with given network setup (see below)
1. When create a backing image by download
1. Then all the backing image copies eventually turn to ready
1. When create a volume from the backing image
1. Then the volume is created without any issue

The cluster network setups to verify:

1. IPv6 single-stack
2. dual-stack IPv6-first
3. dual-stack IPv4-first with IPv6 storage network

**Comment by c3y1huang** [comment]
> * [x] **Code Changes**
    Have all required code changes been merged?
    - longhorn/go-common-libs#210
    - longhorn/backing-image-manager#1010

Is https://github.com/longhorn/longhorn-manager/pull/5123 also part of this issue?

**Comment by COLDTURNIP** [comment]
## Verification Steps

### IPv6

1. Given the IPv6 single-stack Kubernetes cluster
2. And Longhorn is installed.
3. And a 1-copy backing image.
4. When change the number of copy to 2.
    ```bash
    $ kubectl -n longhorn-system patch backingimage test-image --type=merge -p '{"spec":{"minNumberOfCopies":2}}'
    ```
5. Then the second copy eventually get prepared.
    ```bash
    $ kubectl -n longhorn-system get backingimage test-image -o json | jq '.status.diskFileStatusMap'
    {
      "2cd989bd-d3d4-4ab8-9e6f-c4bd56310334": {
        "dataEngine": "v1",
        "lastStateTransitionTime": "2026-09-03T06:02:34Z",
        "message": "",
        "progress": 100,
        "state": "ready"
      },
      "96029ca2-2fa8-40b3-910e-f8ae43f53ea6": {
        "dataEngine": "v1",
        "lastStateTransitionTime": "2026-09-03T06:14:14Z",
        "message": "",
        "progress": 100,
        "state": "ready"
      }
    }
    ```

### Dual-stack

1. Given the IPv6-first dual-stack Kubernetes cluster
2. And Longhorn is installed.
3. And a 1-copy backing image.
4. When change the number of copy to 2.
    ```bash
    $ kubectl -n longhorn-system patch backingimage test-image --type=merge -p '{"spec":{"minNumberOfCopies":2}}'
    ```
5. Then the second copy eventually get prepared.
    ```bash
    $ kubectl -n longhorn-system get backingimage test-image -o json | jq '.status.diskFileStatusMap'
    {
      "2cd989bd-d3d4-4ab8-9e6f-c4bd56310334": {
        "dataEngine": "v1",
        "lastStateTransitionTime": "2026-09-03T06:02:34Z",
        "message": "",
        "progress": 100,
        "state": "ready"
      },
      "96029ca2-2fa8-40b3-910e-f8ae43f53ea6": {
        "dataEngine": "v1",
        "lastStateTransitionTime": "2026-09-03T06:14:14Z",
        "message": "",
        "progress": 100,
        "state": "ready"
      }
    }
    ```

### Dual-stack with single-stack storage network

1. Given the IPv4-first dual-stack Kubernetes cluster with CNI multiplexer ready (typically use Multus)
2. And a IPv6 single-stack NAD is configured
3. And Longhorn is installed.
4. And setup Longhorn storage network using given IPv6 single-stack NAD.
5. And a 1-copy backing image.
6. And a BIM pod is up to serve the backing image copy. Open a new terminal attach a ephemeral debug container.
    ```bash
    kubectl debug -n longhorn-system -it "pod/${POD}" \
      --container=traffic-capture --target=backing-image-manager \
      --profile=netadmin --image=nicolaka/netshoot:latest -- sh
    ```
7. And this BIM pod has two available network interface, one for IPv4 dual-stack, and another one is the IPv6 storage network.
    ```bash
    $ ip -brief address show
    lo               UNKNOWN        127.0.0.1/8 ::1/128
    eth0@if28        UP             10.42.3.23/24 fd42:0:0:3::17/64 fe80::2866:a6ff:fe10:aada/64
    lhnet1@if3       UP             fd00:dead:beef::8008/113 fe80::84b5:9cff:fee1:a7e3/64
    ```
9. And keep collecting traffic for network interface `lhnet1` from this BIM
    ```bash
    tcpdump -ni lhnet1 -nn -s 0 -l 'ip6 and tcp'
    ```
10. When change the number of copy to 2 outside of the BIM pod.
    ```bash
    kubectl -n longhorn-system patch backingimage test-image --type=merge -p '{"spec":{"minNumberOfCopies":2}}'
    ```
11. Then the second copy eventually get prepared.
    ```bash
    $ kubectl -n longhorn-system get backingimage test-image -o json | jq '.status.diskFileStatusMap'
    {
        "2cd989bd-d3d4-4ab8-9e6f-c4bd56310334": {
        "dataEngine": "v1",
        "lastStateTransitionTime": "2026-09-03T06:02:34Z",
        "message": "",
        "progress": 100,
        "state": "ready"
      },
      "96029ca2-2fa8-40b3-910e-f8ae43f53ea6": {
        "dataEngine": "v1",
        "lastStateTransitionTime": "2026-09-03T06:14:14Z",
        "message": "",
        "progress": 100,
        "state": "ready"
      }
    }
    ```
12. And the BIM traffic passes through `lhnet1`
    ```
    tcpdump: verbose output suppressed, use -v[v]... for full protocol decode
    listening on lhnet1, link-type EN10MB (Ethernet), snapshot length 262144 bytes
    06:14:11.056365 IP6 fd00:dead:beef::8007.42992 > fd00:dead:beef::8008.8000: Flags [S], seq 3548757606, win 64800, options [mss 1440,sackOK,TS val 563956587 ecr 0,nop,wscale 9], length 0
    06:14:11.056404 IP6 fd00:dead:beef::8008.8000 > fd00:dead:beef::8007.42992: Flags [S.], seq 3893336490, ack 3548757607, win 64260, options [mss 1440,sackOK,TS val 2959174158 ecr 563956587,nop,wscale 9], length 0
    06:14:11.056477 IP6 fd00:dead:beef::8007.42992 > fd00:dead:beef::8008.8000: Flags [.], ack 1, win 127, options [nop,nop,TS val 563956587 ecr 2959174158], length 0
    06:14:11.056634 IP6 fd00:dead:beef::8007.42992 > fd00:dead:beef::8008.8000: Flags [P.], seq 1:25, ack 1, win 127, options [nop,nop,TS val 563956588 ecr 2959174158], length 24
    06:14:11.056645 IP6 fd00:dead:beef::8008.8000 > fd00:dead:beef::8007.42992: Flags [.], ack 25, win 126, options [nop,nop,TS val 2959174159 ecr 563956588], length 0
    06:14:11.056668 IP6 fd00:dead:beef::8007.42992 > fd00:dead:beef::8008.8000: Flags [P.], seq 25:34, ack 1, win 127, options [nop,nop,TS val 563956588 ecr 2959174158], length 9
    ...
```

**Comment by WebberHuang1118** [comment]
For the [test plan](https://github.com/longhorn/longhorn/issues/13864#issuecomment-5521693187), IIUC, it does not appear to cover data integrity verification, right? Should we include this scenario as well?

CC @derekbit @Vicente-Cheng @martindekov

**Comment by derekbit** [comment]
Hello @yangchiu Please revalidate the four test cases in https://github.com/longhorn/longhorn/issues/13933#issue-5330695412 together. Thanks.

**Comment by derekbit** [comment]
> For the [test plan](https://github.com/longhorn/longhorn/issues/13864#issuecomment-5521693187), IIUC, it does not appear to cover data integrity verification, right? Should we include this scenario as well?
> 
> CC [@derekbit](https://github.com/derekbit) [@Vicente-Cheng](https://github.com/Vicente-Cheng) [@martindekov](https://github.com/martindekov)

@COLDTURNIP Could you help this? Thanks.

**Comment by yangchiu** [comment]
Verification passed on master-head (longhorn-manager 3a21547) and v1.13.x-head (longhorn-manager 07ad3f5) by following [the test plan](https://github.com/longhorn/longhorn/issues/13864#issuecomment-5521693187).

In the `IPv6` and `Dual-stack` envirinment, updating the number of copy of a backing image works as expected:

```
# kubectl -n longhorn-system get backingimage bi -o json | jq '.status.diskFileStatusMap'
{
  "876a8cf4-ea33-4cd6-b1ab-93dc5c87f63b": {
    "dataEngine": "v1",
    "lastStateTransitionTime": "2026-09-11T00:49:30Z",
    "message": "",
    "progress": 100,
    "state": "ready"
  },
  "cbce68c7-de5b-4c76-b4df-7869aabcd2f7": {
    "dataEngine": "v1",
    "lastStateTransitionTime": "2026-09-11T00:48:55Z",
    "message": "",
    "progress": 100,
    "state": "ready"
  }
}
```

In the `Dual-stack with single-stack storage network` environment:

1. Given the IPv4-first dual-stack Kubernetes cluster:
```
# kubectl get nodes -o jsonpath='{range .items[*]}{.metadata.name}{"\t"}{range .status.addresses
[?(@.type=="InternalIP")]}{.address}{" "}{end}{"\n"}{end}'
ip-10-0-1-252	10.0.1.252 2600:1f18:1482:300:4f97:f5a8:d5da:1d54 
ip-10-0-1-39	10.0.1.39 2600:1f18:1482:300:1717:1fc:41e0:9df6 
ip-10-0-1-4	10.0.1.4 2600:1f18:1482:300:c5d:a32c:c3b4:780f 
```
2. A IPv6 single-stack NAD is configured, and setup Longhorn storage network using the IPv6 single-stack NAD:
```
# kubectl get settings -n longhorn-system | grep storage-network
storage-network    kube-system/demo-fd00-168-0-0    true      41m

+ kubectl get pods -n longhorn-system -l longhorn.io/component=instance-manager -oyaml
+ yq '.items[0].metadata'
annotations:
  k8s.v1.cni.cncf.io/network-status: |-
    [{
        "name": "cbr0",
        "interface": "eth0",
        "ips": [
            "10.42.0.20",
            "fd00:10::14"
        ],
        "mac": "26:95:ff:b3:60:11",
        "default": true,
        "dns": {},
        "gateway": [
            "10.42.0.1",
            "fd00:10::1"
        ]
    },{
        "name": "kube-system/demo-fd00-168-0-0",
        "interface": "lhnet1",
        "ips": [
            "fd00:168:1::2"
        ],
        "mac": "0e:bb:14:46:f1:ad",
        "dns": {}
    }]
  k8s.v1.cni.cncf.io/networks: '[{"namespace": "kube-system", "name": "demo-fd00-168-0-0", "interface": "lhnet1"}]'
  longhorn.io/last-applied-tolerations: '[]'
```
3. Create a 1-copy backing image
4. And a BIM pod is up to serve the backing image copy. Open a new terminal attach a ephemeral debug container, and this BIM pod has two available network interface, one for `IPv4 dual-stack`, and another one is the `IPv6 storage network`:
```
# kubectl debug -n longhorn-system -it "pod/bim-a950be42ab172ab997b93e0608944825438e1f8f303347e9
47fc1e6b" \
>   --container=traffic-capture --target=backing-image-manager \
>   --profile=netadmin --image=nicolaka/netshoot:latest -- sh
Targeting container "backing-image-manager". If you don't see processes from this container it may be because the container runtime doesn't support this feature.
If you don't see a command prompt, try pressing enter.
~ # ip -brief address show
lo               UNKNOWN        127.0.0.1/8 ::1/128 
eth0@if27        UP             10.42.2.22/24 fd00:10:0:2::16/64 fe80::d0db:88ff:fea0:a012/64 
lhnet1@if3       UNKNOWN        fd00:168:3::5/64 fe80::e8c:be00:470:8129/64 
```
5. Collecting traffic for network interface lhnet1 from this BIM:
```
~ # tcpdump -ni lhnet1 -nn -s 0 -l 'ip6 and tcp'
tcpdump: verbose output suppressed, use -v[v]... for full protocol decode
listening on lhnet1, link-type EN10MB (Ethernet), snapshot length 262144 bytes
```
6. update the number of copy of the backing image to 2:
```
# kubectl -n longhorn-system get backingimage bi -o json | jq '.status.diskFileStatusMap'
{
  "b025a22c-71cd-4edc-9411-9196fb455669": {
    "dataEngine": "v1",
    "lastStateTransitionTime": "2026-09-10T23:47:27Z",
    "message": "",
    "progress": 100,
    "state": "ready"
  },
  "f8d1d94c-c301-4107-a214-c04c27219c2e": {
    "dataEngine": "v1",
    "lastStateTransitionTime": "2026-09-10T23:45:23Z",
    "message": "",
    "progress": 100,
    "state": "ready"
  }
}
```
7. And observe the BIM traffic passes through lhnet1:
```
~ # tcpdump -ni lhnet1 -nn -s 0 -l 'ip6 and tcp'
tcpdump: verbose output suppressed, use -v[v]... for full protocol decode
listening on lhnet1, link-type EN10MB (Ethernet), snapshot length 262144 bytes
23:47:21.071252 IP6 fd00:168:2::4.48366 > fd00:168:3::5.8000: Flags [S], seq 3799261746, win 62237, options [mss 8891,sackOK,TS val 3436981657 ecr 0,nop,wscale 7], length 0
23:47:21.071294 IP6 fd00:168:3::5.8000 > fd00:168:2::4.48366: Flags [S.], seq 1912116862, ack 3799261747, win 62153, options [mss 8891,sackOK,TS val 1180918274 ecr 3436981657,nop,wscale 7], length 0
23:47:21.071869 IP6 fd00:168:2::4.48366 > fd00:168:3::5.8000: Flags [.], ack 1, win 487, options [nop,nop,TS val 3436981666 ecr 1180918274], length 0
23:47:21.072132 IP6 fd00:168:3::5.8000 > fd00:168:2::4.48366: Flags [P.], seq 1:16, ack 1, win 486, options [nop,nop,TS val 1180918275 ecr 3436981666], length 15
23:47:21.072494 IP6 fd00:168:2::4.48366 > fd00:168:3::5.8000: Flags [.], ack 16, win 487, options [nop,nop,TS val 3436981667 ecr 1180918275], length 0
23:47:21.072716 IP6 fd00:168:2::4.48366 > fd00:168:3::5.8000: Flags [P.], seq 1:25, ack 16, win 487, options [nop,nop,TS val 3436981667 ecr 1180918275], length 24
23:47:21.072735 IP6 fd00:168:3::5.8000 > fd00:168:2::4.48366: Flags [.], ack 25, win 486, options [nop,nop,TS val 1180918275 ecr 3436981667], length 0
23:47:21.072716 IP6 fd00:168:2::4.48366 > fd00:168:3::5.8000: Flags [P.], seq 25:34, ack 16, win 487, options [nop,nop,TS val 3436981667 ecr 1180918275], length 9
23:47:21.072767 IP6 fd00:168:3::5.8000 > fd00:168:2::4.48366: Flags [.], ack 34, win 486, options [nop,nop,TS val 1180918275 ecr 3436981667], length 0
23:47:21.072780 IP6 fd00:168:2::4.48366 > fd00:168:3::5.8000: Flags [P.], seq 34:43, ack 16, win 487, options [nop,nop,TS val 3436981667 ecr 1180918275], length 9
23:47:21.072788 IP6 fd00:168:3::5.8000 > fd00:168:2::4.48366: Flags [.], ack 43, win 486, options [nop,nop,TS val 1180918275 ecr 3436981667], length 0
23:47:21.073259 IP6 fd00:168:2::4.48366 > fd00:168:3::5.8000: Flags [P.], seq 43:159, ack 16, win 487, options [nop,nop,TS val 3436981668 ecr 1180918275], length 116
23:47:21.073270 IP6 fd00:168:3::5.8000 > fd00:168:2::4.48366: Flags [.], ack 159, win 486, options [nop,nop,TS val 1180918276 ecr 3436981668], length 0
23:47:21.073645 IP6 fd00:168:2::4.48366 > fd00:168:3::5.8000: Flags [P.], seq 159:210, ack 16, win 487, options [nop,nop,TS val 3436981668 ecr 1180918275], length 51
23:47:21.073657 IP6 fd00:168:3::5.8000 > fd00:168:2::4.48366: Flags [.], ack 210, win 486, options [nop,nop,TS val 1180918276 ecr 3436981668], length 0
23:47:21.073909 IP6 fd00:168:3::5.8000 > fd00:168:2::4.48366: Flags [P.], seq 16:25, ack 210, win 486, options [nop,nop,TS val 1180918277 ecr 3436981668], length 9
23:47:21.074358 IP6 fd00:168:3::5.8000 > fd00:168:2::4.48366: Flags [P.], seq 25:55, ack 210, win 486, options [nop,nop,TS val 1180918277 ecr 3436981668], length 30
23:47:21.074819 IP6 fd00:168:3::5.42662 > fd00:168:2::4.30001: Flags [S], seq 107585488, win 62237, options [mss 8891,sackOK,TS val 1180918277 ecr 0,nop,wscale 7], length 0
23:47:21.075004 IP6 fd00:168:2::4.48366 > fd00:168:3::5.8000: Flags [.], ack 55, win 487, options [nop,nop,TS val 3436981669 ecr 1180918277], length 0
23:47:21.075519 IP6 fd00:168:3::5.8000 > fd00:168:2::4.48366: Flags [P.], seq 55:125, ack 210, win 486, options [nop,nop,TS val 1180918278 ecr 3436981669], length 70
23:47:21.075416 IP6 fd00:168:2::4.48366 > fd00:168:3::5.8000: Flags [P.], seq 210:227, ack 55, win 487, options [nop,nop,TS val 3436981669 ecr 1180918277], length 17
23:47:21.075583 IP6 fd00:168:2::4.30001 > fd00:168:3::5.42662: Flags [S.], seq 2899722106, ack 107585489, win 62153, options [mss 8891,sackOK,TS val 3436981670 ecr 1180918277,nop,wscale 7], length 0
23:47:21.075595 IP6 fd00:168:3::5.42662 > fd00:168:2::4.30001: Flags [.], ack 1, win 487, options [nop,nop,TS val 1180918278 ecr 3436981670], length 0
23:47:21.077062 IP6 fd00:168:3::5.42662 > fd00:168:2::4.30001: Flags [P.], seq 1:177, ack 1, win 487, options [nop,nop,TS val 1180918280 ecr 3436981670], length 176
23:47:21.077448 IP6 fd00:168:2::4.48366 > fd00:168:3::5.8000: Flags [P.], seq 227:299, ack 125, win 487, options [nop,nop,TS val 3436981672 ecr 1180918278], length 72
23:47:21.077448 IP6 fd00:168:2::4.48366 > fd00:168:3::5.8000: Flags [F.], seq 299, ack 125, win 487, options [nop,nop,TS val 3436981672 ecr 1180918278], length 0
23:47:21.077475 IP6 fd00:168:2::4.30001 > fd00:168:3::5.42662: Flags [.], ack 177, win 485, options [nop,nop,TS val 3436981672 ecr 1180918280], length 0
23:47:21.077482 IP6 fd00:168:3::5.8000 > fd00:168:2::4.48366: Flags [.], ack 300, win 486, options [nop,nop,TS val 1180918280 ecr 3436981669], length 0
23:47:21.077548 IP6 fd00:168:3::5.8000 > fd00:168:2::4.48366: Flags [F.], seq 125, ack 300, win 486, options [nop,nop,TS val 1180918280 ecr 3436981669], length 0
23:47:21.077887 IP6 fd00:168:2::4.48366 > fd00:168:3::5.8000: Flags [.], ack 126, win 487, options [nop,nop,TS val 3436981672 ecr 1180918280], length 0
23:47:21.078243 IP6 fd00:168:2::4.30001 > fd00:168:3::5.42662: Flags [P.], seq 1:113, ack 177, win 485, options [nop,nop,TS val 3436981673 ecr 1180918280], length 112
23:47:21.078255 IP6 fd00:168:3::5.42662 > fd00:168:2::4.30001: Flags [.], ack 113, win 487, options [nop,nop,TS val 1180918281 ecr 3436981673], length 0
23:47:21.079610 IP6 fd00:168:3::5.42662 > fd00:168:2::4.30001: Flags [P.], seq 177:4273, ack 113, win 487, options [nop,nop,TS val 1180918282 ecr 3436981673], length 4096
23:47:21.079647 IP6 fd00:168:3::5.42662 > fd00:168:2::4.30001: Flags [P.], seq 4273:8560, ack 113, win 487, options [nop,nop,TS val 1180918282 ecr 3436981673], length 4287
23:47:21.079743 IP6 fd00:168:3::5.42666 > fd00:168:2::4.30001: Flags [S], seq 4150227398, win 62237, options [mss 8891,sackOK,TS val 1180918282 ecr 0,nop,wscale 7], length 0
23:47:21.079827 IP6 fd00:168:3::5.42674 > fd00:168:2::4.30001: Flags [S], seq 3834264905, win 62237, options [mss 8891,sackOK,TS val 1180918282 ecr 0,nop,wscale 7], length 0
23:47:21.079903 IP6 fd00:168:3::5.42676 > fd00:168:2::4.30001: Flags [S], seq 1336895354, win 62237, options [mss 8891,sackOK,TS val 1180918283 ecr 0,nop,wscale 7], length 0
23:47:21.080185 IP6 fd00:168:2::4.30001 > fd00:168:3::5.42662: Flags [.], ack 8560, win 443, options [nop,nop,TS val 3436981674 ecr 1180918282], length 0
23:47:21.080155 IP6 fd00:168:2::4.30001 > fd00:168:3::5.42666: Flags [S.], seq 1678338273, ack 4150227399, win 62153, options [mss 8891,sackOK,TS val 3436981674 ecr 1180918282,nop,wscale 7], length 0
23:47:21.080209 IP6 fd00:168:3::5.42666 > fd00:168:2::4.30001: Flags [.], ack 1, win 487, options [nop,nop,TS val 1180918283 ecr 3436981674], length 0
23:47:21.080278 IP6 fd00:168:2::4.30001 > fd00:168:3::5.42674: Flags [S.], seq 3615291512, ack 3834264906, win 62153, options [mss 8891,sackOK,TS val 3436981675 ecr 1180918282,nop,wscale 7], length 0
23:47:21.080294 IP6 fd00:168:3::5.42674 > fd00:168:2::4.30001: Flags [.], ack 1, win 487, options [nop,nop,TS val 1180918283 ecr 3436981675], length 0
23:47:21.080292 IP6 fd00:168:2::4.30001 > fd00:168:3::5.42676: Flags [S.], seq 79144547, ack 1336895355, win 62153, options [mss 8891,sackOK,TS val 3436981675 ecr 1180918283,nop,wscale 7], length 0
23:47:21.080312 IP6 fd00:168:3::5.42676 > fd00:168:2::4.30001: Flags [.], ack 1, win 487, options [nop,nop,TS val 1180918283 ecr 3436981675], length 0
23:47:21.080392 IP6 fd00:168:3::5.42676 > fd00:168:2::4.30001: Flags [P.], seq 1:187, ack 1, win 487, options [nop,nop,TS val 1180918283 ecr 3436981675], length 186
23:47:21.080421 IP6 fd00:168:2::4.30001 > fd00:168:3::5.42662: Flags [P.], seq 113:188, ack 8560, win 476, options [nop,nop,TS val 3436981675 ecr 1180918282], length 75
23:47:21.080452 IP6 fd00:168:3::5.42674 > fd00:168:2::4.30001: Flags [P.], seq 1:4097, ack 1, win 487, options [nop,nop,TS val 1180918283 ecr 3436981675], length 4096
23:47:21.080493 IP6 fd00:168:3::5.42674 > fd00:168:2::4.30001: Flags [P.], seq 4097:4283, ack 1, win 487, options [nop,nop,TS val 1180918283 ecr 3436981675], length 186
23:47:21.080525 IP6 fd00:168:3::5.42662 > fd00:168:2::4.30001: Flags [P.], seq 8560:12656, ack 188, win 487, options [nop,nop,TS val 1180918283 ecr 3436981675], length 4096
23:47:21.080562 IP6 fd00:168:3::5.42662 > fd00:168:2::4.30001: Flags [P.], seq 12656:16945, ack 188, win 487, options [nop,nop,TS val 1180918283 ecr 3436981675], length 4289
23:47:21.080591 IP6 fd00:168:3::5.42666 > fd00:168:2::4.30001: Flags [P.], seq 1:189, ack 1, win 487, options [nop,nop,TS val 1180918283 ecr 3436981674], length 188
23:47:21.080759 IP6 fd00:168:2::4.30001 > fd00:168:3::5.42676: Flags [.], ack 187, win 485, options [nop,nop,TS val 3436981675 ecr 1180918283], length 0
23:47:21.080809 IP6 fd00:168:2::4.30001 > fd00:168:3::5.42674: Flags [.], ack 4097, win 454, options [nop,nop,TS val 3436981675 ecr 1180918283], length 0
23:47:21.080849 IP6 fd00:168:2::4.30001 > fd00:168:3::5.42674: Flags [.], ack 4283, win 453, options [nop,nop,TS val 3436981675 ecr 1180918283], length 0
23:47:21.080924 IP6 fd00:168:2::4.30001 > fd00:168:3::5.42666: Flags [.], ack 189, win 485, options [nop,nop,TS val 3436981675 ecr 1180918283], length 0
23:47:21.082243 IP6 fd00:168:2::4.30001 > fd00:168:3::5.42662: Flags [.], ack 16945, win 443, options [nop,nop,TS val 3436981677 ecr 1180918283], length 0
23:47:21.082349 IP6 fd00:168:2::4.30001 > fd00:168:3::5.42662: Flags [P.], seq 188:263, ack 16945, win 476, options [nop,nop,TS val 3436981677 ecr 1180918283], length 75
23:47:21.082456 IP6 fd00:168:3::5.42662 > fd00:168:2::4.30001: Flags [P.], seq 16945:17134, ack 263, win 487, options [nop,nop,TS val 1180918285 ecr 3436981677], length 189
23:47:21.082460 IP6 fd00:168:2::4.30001 > fd00:168:3::5.42676: Flags [P.], seq 1:76, ack 187, win 485, options [nop,nop,TS val 3436981677 ecr 1180918283], length 75
23:47:21.082491 IP6 fd00:168:3::5.42676 > fd00:168:2::4.30001: Flags [.], ack 76, win 487, options [nop,nop,TS val 1180918285 ecr 3436981677], length 0
23:47:21.082542 IP6 fd00:168:2::4.30001 > fd00:168:3::5.42674: Flags [P.], seq 1:76, ack 4283, win 456, options [nop,nop,TS val 3436981677 ecr 1180918283], length 75
23:47:21.082552 IP6 fd00:168:3::5.42674 > fd00:168:2::4.30001: Flags [.], ack 76, win 487, options [nop,nop,TS val 1180918285 ecr 3436981677], length 0
23:47:21.082593 IP6 fd00:168:3::5.42676 > fd00:168:2::4.30001: Flags [P.], seq 187:4283, ack 76, win 487, options [nop,nop,TS val 1180918285 ecr 3436981677], length 4096
23:47:21.082611 IP6 fd00:168:3::5.42676 > fd00:168:2::4.30001: Flags [P.], seq 4283:8572, ack 76, win 487, options [nop,nop,TS val 1180918285 ecr 3436981677], length 4289
23:47:21.082659 IP6 fd00:168:3::5.42674 > fd00:168:2::4.30001: Flags [P.], seq 4283:4472, ack 76, win 487, options [nop,nop,TS val 1180918285 ecr 3436981677], length 189
23:47:21.082814 IP6 fd00:168:2::4.30001 > fd00:168:3::5.42666: Flags [P.], seq 1:76, ack 189, win 485, options [nop,nop,TS val 3436981677 ecr 1180918283], length 75
23:47:21.082827 IP6 fd00:168:3::5.42666 > fd00:168:2::4.30001: Flags [.], ack 76, win 487, options [nop,nop,TS val 1180918285 ecr 3436981677], length 0
23:47:21.082927 IP6 fd00:168:2::4.30001 > fd00:168:3::5.42662: Flags [P.], seq 263:338, ack 17134, win 476, options [nop,nop,TS val 3436981677 ecr 1180918285], length 75
23:47:21.083001 IP6 fd00:168:2::4.30001 > fd00:168:3::5.42676: Flags [.], ack 8572, win 443, options [nop,nop,TS val 3436981677 ecr 1180918285], length 0
23:47:21.083080 IP6 fd00:168:2::4.30001 > fd00:168:3::5.42676: Flags [P.], seq 76:151, ack 8572, win 476, options [nop,nop,TS val 3436981677 ecr 1180918285], length 75
23:47:21.083121 IP6 fd00:168:2::4.30001 > fd00:168:3::5.42674: Flags [P.], seq 76:151, ack 4472, win 456, options [nop,nop,TS val 3436981677 ecr 1180918285], length 75
23:47:21.083365 IP6 fd00:168:3::5.42666 > fd00:168:2::4.30001: Flags [P.], seq 189:4285, ack 76, win 487, options [nop,nop,TS val 1180918286 ecr 3436981677], length 4096
23:47:21.083395 IP6 fd00:168:3::5.42666 > fd00:168:2::4.30001: Flags [P.], seq 4285:12671, ack 76, win 487, options [nop,nop,TS val 1180918286 ecr 3436981677], length 8386
23:47:21.083733 IP6 fd00:168:2::4.30001 > fd00:168:3::5.42666: Flags [.], ack 12671, win 538, options [nop,nop,TS val 3436981678 ecr 1180918286], length 0
23:47:21.084265 IP6 fd00:168:2::4.30001 > fd00:168:3::5.42666: Flags [P.], seq 76:151, ack 12671, win 538, options [nop,nop,TS val 3436981679 ecr 1180918286], length 75
23:47:21.089304 IP6 fd00:168:3::5.42662 > fd00:168:2::4.30001: Flags [P.], seq 17134:17323, ack 338, win 487, options [nop,nop,TS val 1180918292 ecr 3436981677], length 189
23:47:21.089362 IP6 fd00:168:3::5.42674 > fd00:168:2::4.30001: Flags [P.], seq 4472:8568, ack 151, win 487, options [nop,nop,TS val 1180918292 ecr 3436981677], length 4096
23:47:21.089388 IP6 fd00:168:3::5.42674 > fd00:168:2::4.30001: Flags [P.], seq 8568:35205, ack 151, win 487, options [nop,nop,TS val 1180918292 ecr 3436981677], length 26637
23:47:21.089438 IP6 fd00:168:3::5.42674 > fd00:168:2::4.30001: Flags [P.], seq 35205:61842, ack 151, win 487, options [nop,nop,TS val 1180918292 ecr 3436981677], length 26637
23:47:21.089950 IP6 fd00:168:2::4.30001 > fd00:168:3::5.42662: Flags [P.], seq 338:413, ack 17323, win 476, options [nop,nop,TS val 3436981684 ecr 1180918292], length 75
23:47:21.089950 IP6 fd00:168:2::4.30001 > fd00:168:3::5.42674: Flags [.], ack 61842, win 269, options [nop,nop,TS val 3436981684 ecr 1180918292], length 0
23:47:21.089969 IP6 fd00:168:3::5.42674 > fd00:168:2::4.30001: Flags [P.], seq 61842:96274, ack 151, win 487, options [nop,nop,TS val 1180918293 ecr 3436981684], length 34432
23:47:21.090377 IP6 fd00:168:2::4.30001 > fd00:168:3::5.42674: Flags [.], ack 96274, win 429, options [nop,nop,TS val 3436981685 ecr 1180918293], length 0
23:47:21.090396 IP6 fd00:168:3::5.42674 > fd00:168:2::4.30001: Flags [P.], seq 96274:151186, ack 151, win 487, options [nop,nop,TS val 1180918293 ecr 3436981685], length 54912
23:47:21.090802 IP6 fd00:168:2::4.30001 > fd00:168:3::5.42674: Flags [.], ack 151186, win 456, options [nop,nop,TS val 3436981685 ecr 1180918293], length 0
23:47:21.090818 IP6 fd00:168:3::5.42674 > fd00:168:2::4.30001: Flags [P.], seq 151186:195027, ack 151, win 487, options [nop,nop,TS val 1180918293 ecr 3436981685], length 43841
23:47:21.090855 IP6 fd00:168:3::5.42674 > fd00:168:2::4.30001: Flags [P.], seq 195027:209554, ack 151, win 487, options [nop,nop,TS val 1180918293 ecr 3436981685], length 14527
23:47:21.091233 IP6 fd00:168:2::4.30001 > fd00:168:3::5.42674: Flags [.], ack 195027, win 1142, options [nop,nop,TS val 3436981686 ecr 1180918293], length 0
23:47:21.091245 IP6 fd00:168:3::5.42674 > fd00:168:2::4.30001: Flags [P.], seq 209554:271707, ack 151, win 487, options [nop,nop,TS val 1180918294 ecr 3436981686], length 62153
23:47:21.091270 IP6 fd00:168:3::5.42674 > fd00:168:2::4.30001: Flags [P.], seq 271707:301575, ack 151, win 487, options [nop,nop,TS val 1180918294 ecr 3436981686], length 29868
23:47:21.091278 IP6 fd00:168:3::5.42674 > fd00:168:2::4.30001: Flags [P.], seq 301575:337091, ack 151, win 487, options [nop,nop,TS val 1180918294 ecr 3436981686], length 35516
23:47:21.091275 IP6 fd00:168:2::4.30001 > fd00:168:3::5.42674: Flags [.], ack 209554, win 1368, options [nop,nop,TS val 3436981686 ecr 1180918293], length 0
23:47:21.091288 IP6 fd00:168:3::5.42674 > fd00:168:2::4.30001: Flags [P.], seq 337091:372607, ack 151, win 487, options [nop,nop,TS val 1180918294 ecr 3436981686], length 35516
23:47:21.091681 IP6 fd00:168:2::4.30001 > fd00:168:3::5.42674: Flags [.], ack 245070, win 1923, options [nop,nop,TS val 3436981686 ecr 1180918294], length 0
23:47:21.091724 IP6 fd00:168:3::5.42674 > fd00:168:2::4.30001: Flags [P.], seq 372607:408123, ack 151, win 487, options [nop,nop,TS val 1180918294 ecr 3436981686], length 35516
23:47:21.091761 IP6 fd00:168:3::5.42674 > fd00:168:2::4.30001: Flags [P.], seq 408123:443639, ack 151, win 487, options [nop,nop,TS val 1180918294 ecr 3436981686], length 35516
23:47:21.091681 IP6 fd00:168:2::4.30001 > fd00:168:3::5.42674: Flags [.], ack 271707, win 2340, options [nop,nop,TS val 3436981686 ecr 1180918294], length 0
23:47:21.091777 IP6 fd00:168:3::5.42674 > fd00:168:2::4.30001: Flags [P.], seq 443639:488034, ack 151, win 487, options [nop,nop,TS val 1180918294 ecr 3436981686], length 44395
23:47:21.091702 IP6 fd00:168:2::4.30001 > fd00:168:3::5.42674: Flags [.], ack 301575, win 2806, options [nop,nop,TS val 3436981686 ecr 1180918294], length 0
23:47:21.091702 IP6 fd00:168:2::4.30001 > fd00:168:3::5.42674: Flags [.], ack 328212, win 3223, options [nop,nop,TS val 3436981686 ecr 1180918294], length 0
23:47:21.091829 IP6 fd00:168:3::5.42674 > fd00:168:2::4.30001: Flags [P.], seq 488034:541308, ack 151, win 487, options [nop,nop,TS val 1180918294 ecr 3436981686], length 53274
23:47:21.091888 IP6 fd00:168:3::5.42674 > fd00:168:2::4.30001: Flags [P.], seq 541308:594582, ack 151, win 487, options [nop,nop,TS val 1180918294 ecr 3436981686], length 53274
23:47:21.091982 IP6 fd00:168:2::4.30001 > fd00:168:3::5.42674: Flags [.], ack 363728, win 3777, options [nop,nop,TS val 3436981686 ecr 1180918294], length 0
23:47:21.091997 IP6 fd00:168:3::5.42674 > fd00:168:2::4.30001: Flags [P.], seq 594582:631160, ack 151, win 487, options [nop,nop,TS val 1180918295 ecr 3436981686], length 36578
23:47:21.092231 IP6 fd00:168:3::5.42674 > fd00:168:2::4.30001: Flags [P.], seq 631160:684434, ack 151, win 487, options [nop,nop,TS val 1180918295 ecr 3436981686], length 53274
23:47:21.092392 IP6 fd00:168:2::4.30001 > fd00:168:3::5.42674: Flags [.], ack 408123, win 4471, options [nop,nop,TS val 3436981687 ecr 1180918294], length 0
23:47:21.092399 IP6 fd00:168:3::5.42674 > fd00:168:2::4.30001: Flags [P.], seq 684434:746587, ack 151, win 487, options [nop,nop,TS val 1180918295 ecr 3436981687], length 62153
23:47:21.092450 IP6 fd00:168:2::4.30001 > fd00:168:3::5.42674: Flags [.], ack 425881, win 4749, options [nop,nop,TS val 3436981687 ecr 1180918294], length 0
23:47:21.092456 IP6 fd00:168:3::5.42674 > fd00:168:2::4.30001: Flags [P.], seq 746587:808740, ack 151, win 487, options [nop,nop,TS val 1180918295 ecr 3436981687], length 62153
23:47:21.092512 IP6 fd00:168:2::4.30001 > fd00:168:3::5.42674: Flags [.], ack 443639, win 5026, options [nop,nop,TS val 3436981687 ecr 1180918294], length 0
23:47:21.092627 IP6 fd00:168:2::4.30001 > fd00:168:3::5.42674: Flags [.], ack 461397, win 5304, options [nop,nop,TS val 3436981687 ecr 1180918294], length 0
23:47:21.092646 IP6 fd00:168:3::5.42674 > fd00:168:2::4.30001: Flags [P.], seq 808740:842812, ack 151, win 487, options [nop,nop,TS val 1180918295 ecr 3436981687], length 34072
23:47:21.092780 IP6 fd00:168:2::4.30001 > fd00:168:3::5.42674: Flags [.], ack 479155, win 5581, options [nop,nop,TS val 3436981687 ecr 1180918294], length 0
23:47:21.092925 IP6 fd00:168:2::4.30001 > fd00:168:3::5.42674: Flags [.], ack 496913, win 5858, options [nop,nop,TS val 3436981687 ecr 1180918294], length 0
23:47:21.093051 IP6 fd00:168:2::4.30001 > fd00:168:3::5.42674: Flags [.], ack 514671, win 6136, options [nop,nop,TS val 3436981687 ecr 1180918294], length 0
23:47:21.093271 IP6 fd00:168:2::4.30001 > fd00:168:3::5.42674: Flags [.], ack 541308, win 6552, options [nop,nop,TS val 3436981688 ecr 1180918294], length 0
23:47:21.093410 IP6 fd00:168:2::4.30001 > fd00:168:3::5.42674: Flags [.], ack 559066, win 6830, options [nop,nop,TS val 3436981688 ecr 1180918294], length 0
23:47:21.093575 IP6 fd00:168:2::4.30001 > fd00:168:3::5.42674: Flags [.], ack 576824, win 7107, options [nop,nop,TS val 3436981688 ecr 1180918294], length 0
23:47:21.093783 IP6 fd00:168:2::4.30001 > fd00:168:3::5.42674: Flags [.], ack 594582, win 7385, options [nop,nop,TS val 3436981688 ecr 1180918294], length 0
23:47:21.093924 IP6 fd00:168:2::4.30001 > fd00:168:3::5.42674: Flags [.], ack 612340, win 7662, options [nop,nop,TS val 3436981688 ecr 1180918295], length 0
23:47:21.094015 IP6 fd00:168:2::4.30001 > fd00:168:3::5.42674: Flags [.], ack 630098, win 7815, options [nop,nop,TS val 3436981688 ecr 1180918295], length 0
23:47:21.094158 IP6 fd00:168:2::4.30001 > fd00:168:3::5.42674: Flags [.], ack 648918, win 7884, options [nop,nop,TS val 3436981688 ecr 1180918295], length 0
23:47:21.094315 IP6 fd00:168:2::4.30001 > fd00:168:3::5.42674: Flags [.], ack 666676, win 7884, options [nop,nop,TS val 3436981689 ecr 1180918295], length 0
23:47:21.094446 IP6 fd00:168:2::4.30001 > fd00:168:3::5.42674: Flags [.], ack 684434, win 7884, options [nop,nop,TS val 3436981689 ecr 1180918295], length 0
23:47:21.094668 IP6 fd00:168:2::4.30001 > fd00:168:3::5.42674: Flags [.], ack 711071, win 7884, options [nop,nop,TS val 3436981689 ecr 1180918295], length 0
23:47:21.094787 IP6 fd00:168:2::4.30001 > fd00:168:3::5.42674: Flags [.], ack 728829, win 7884, options [nop,nop,TS val 3436981689 ecr 1180918295], length 0
23:47:21.094935 IP6 fd00:168:2::4.30001 > fd00:168:3::5.42674: Flags [.], ack 746587, win 7884, options [nop,nop,TS val 3436981689 ecr 1180918295], length 0
23:47:21.095061 IP6 fd00:168:2::4.30001 > fd00:168:3::5.42674: Flags [.], ack 764345, win 7884, options [nop,nop,TS val 3436981689 ecr 1180918295], length 0
23:47:21.095302 IP6 fd00:168:2::4.30001 > fd00:168:3::5.42674: Flags [.], ack 790982, win 7884, options [nop,nop,TS val 3436981690 ecr 1180918295], length 0
23:47:21.095439 IP6 fd00:168:2::4.30001 > fd00:168:3::5.42674: Flags [.], ack 808740, win 7884, options [nop,nop,TS val 3436981690 ecr 1180918295], length 0
23:47:21.095648 IP6 fd00:168:2::4.30001 > fd00:168:3::5.42674: Flags [.], ack 835377, win 7884, options [nop,nop,TS val 3436981690 ecr 1180918295], length 0
23:47:21.096628 IP6 fd00:168:2::4.30001 > fd00:168:3::5.42674: Flags [P.], seq 151:226, ack 842812, win 7974, options [nop,nop,TS val 3436981691 ecr 1180918295], length 75
23:47:21.098729 IP6 fd00:168:3::5.42674 > fd00:168:2::4.30001: Flags [P.], seq 842812:843000, ack 226, win 487, options [nop,nop,TS val 1180918301 ecr 3436981691], length 188
23:47:21.099153 IP6 fd00:168:2::4.30001 > fd00:168:3::5.42674: Flags [P.], seq 226:310, ack 843000, win 7974, options [nop,nop,TS val 3436981693 ecr 1180918301], length 84
23:47:21.104718 IP6 fd00:168:2::4.30001 > fd00:168:3::5.42674: Flags [P.], seq 310:315, ack 843000, win 7974, options [nop,nop,TS val 3436981699 ecr 1180918301], length 5
23:47:21.104763 IP6 fd00:168:3::5.42674 > fd00:168:2::4.30001: Flags [.], ack 315, win 487, options [nop,nop,TS val 1180918307 ecr 3436981693], length 0
23:47:21.104921 IP6 fd00:168:2::4.30001 > fd00:168:3::5.42662: Flags [F.], seq 413, ack 17323, win 476, options [nop,nop,TS val 3436981699 ecr 1180918292], length 0
23:47:21.104968 IP6 fd00:168:2::4.30001 > fd00:168:3::5.42666: Flags [F.], seq 151, ack 12671, win 538, options [nop,nop,TS val 3436981699 ecr 1180918286], length 0
23:47:21.104986 IP6 fd00:168:2::4.30001 > fd00:168:3::5.42674: Flags [F.], seq 315, ack 843000, win 7974, options [nop,nop,TS val 3436981699 ecr 1180918301], length 0
23:47:21.105023 IP6 fd00:168:2::4.30001 > fd00:168:3::5.42676: Flags [F.], seq 151, ack 8572, win 476, options [nop,nop,TS val 3436981699 ecr 1180918285], length 0
23:47:21.105051 IP6 fd00:168:3::5.42674 > fd00:168:2::4.30001: Flags [F.], seq 843000, ack 316, win 487, options [nop,nop,TS val 1180918308 ecr 3436981699], length 0
23:47:21.105086 IP6 fd00:168:3::5.42666 > fd00:168:2::4.30001: Flags [F.], seq 12671, ack 152, win 487, options [nop,nop,TS val 1180918308 ecr 3436981679], length 0
23:47:21.105105 IP6 fd00:168:3::5.42662 > fd00:168:2::4.30001: Flags [F.], seq 17323, ack 414, win 487, options [nop,nop,TS val 1180918308 ecr 3436981684], length 0
23:47:21.105130 IP6 fd00:168:3::5.42676 > fd00:168:2::4.30001: Flags [F.], seq 8572, ack 152, win 487, options [nop,nop,TS val 1180918308 ecr 3436981677], length 0
23:47:21.105408 IP6 fd00:168:2::4.30001 > fd00:168:3::5.42674: Flags [.], ack 843001, win 7974, options [nop,nop,TS val 3436981700 ecr 1180918308], length 0
23:47:21.105503 IP6 fd00:168:2::4.30001 > fd00:168:3::5.42662: Flags [.], ack 17324, win 476, options [nop,nop,TS val 3436981700 ecr 1180918308], length 0
23:47:21.105503 IP6 fd00:168:2::4.30001 > fd00:168:3::5.42666: Flags [.], ack 12672, win 538, options [nop,nop,TS val 3436981700 ecr 1180918308], length 0
23:47:21.105503 IP6 fd00:168:2::4.30001 > fd00:168:3::5.42676: Flags [.], ack 8573, win 476, options [nop,nop,TS val 3436981700 ecr 1180918308], length 0
^C
148 packets captured
148 packets received by filter
0 packets dropped by kernel
```

Backing image regression test cases passed in different environment:

ipv4 + storage network: https://ci.longhorn.io/job/private/job/longhorn-storage-network-test/448/
ipv6 + storage network: https://ci.longhorn.io/job/private/job/longhorn-storage-network-test/449/
dual-stack ipv4 first + storage network: https://ci.longhorn.io/job/private/job/longhorn-storage-network-test/447/
dual-stack ipv6 first + storage network: https://ci.longhorn.io/job/private/job/longhorn-storage-network-test/450/
ipv4 normal environment: https://ci.longhorn.io/job/public/job/master/job/sles/job/amd64/job/longhorn-tests-sles-amd64/1574/
ipv6 normal environment: https://ci.longhorn.io/job/public/job/master/job/sles/job/amd64/job/longhorn-tests-sles-amd64/1573/
dual-stack ipv4 first normal environment: https://ci.longhorn.io/job/public/job/master/job/sles/job/amd64/job/longhorn-tests-sles-amd64/1575/
dual-stack ipv6 first normal environment: https://ci.longhorn.io/job/public/job/master/job/sles/job/amd64/job/longhorn-tests-sles-amd64/1576/

Also the `test_backup` test case requested in https://github.com/longhorn/longhorn/issues/13864#issuecomment-5627536881 passed:
https://ci.longhorn.io/job/private/job/longhorn-storage-network-test/457/
https://ci.longhorn.io/job/private/job/longhorn-storage-network-test/456/
https://ci.longhorn.io/job/private/job/longhorn-storage-network-test/455/
https://ci.longhorn.io/job/private/job/longhorn-storage-network-test/454/
