### ISSUE TITLE
[QUESTION] Disabled nodes -> FailedMount for pod that landed on such a disabled node

### ISSUE THREAD

**Issue by opstalj** [longhorn/longhorn#3909]
## Question
I have a k8s vanilla cluster with 10 worker nodes. When setting up longhorn, I got an issue on 2 worker nodes, so for the moment, I have disabled these 2 worker nodes (nodes: tgnm and ti76).

Issue: I created a pod that needs a PVC and the pod landed on the disabled node ti76. Now, it looks like it can't make use of the PVC due to the following error when describing the pod:

> "  Normal   SuccessfulAttachVolume  3m21s                attachdetach-controller  AttachVolume.Attach succeeded for volume "pvc-925b9d38-8fda-4d90-bc75-879ac36342e8"
>   Warning  FailedMount             99s                  kubelet                  MountVolume.MountDevice failed for volume "pvc-925b9d38-8fda-4d90-bc75-879ac36342e8" : rpc error: code = Internal desc = Get "http://longhorn-backend:9500/v1/volumes/pvc-925b9d38-8fda-4d90-bc75-879ac36342e8": dial tcp 10.96.103.91:9500: i/o timeout (Client.Timeout exceeded while awaiting headers)
>   Warning  FailedMount             87s                  kubelet                  Unable to attach or mount volumes: unmounted volumes=[data], unattached volumes=[config kube-api-access-mvcx6 data]: timed out waiting for the condition
>   Warning  FailedMount             57s (x7 over 3m11s)  kubelet                  MountVolume.MountDevice failed for volume "pvc-925b9d38-8fda-4d90-bc75-879ac36342e8" : rpc error: code = Internal desc = Get "http://longhorn-backend:9500/v1/volumes/pvc-925b9d38-8fda-4d90-bc75-879ac36342e8": context deadline exceeded (Client.Timeout exceeded while awaiting headers)"

 -> the pod remains in **ContainerCreating** due to this...

Looking at the instance manager pods on ti76, I noticed:

> [longhorn-manager-9xpwb] time="2022-05-03T07:02:06Z" level=info msg="Instance manager state is updated from starting to running after syncing with the pod" controller=longhorn-instance-manager instanceManager=instance-manager-r-8500a7a8 node=ti76 nodeID=ti76
> [longhorn-manager-9xpwb] time="2022-05-03T07:02:06Z" level=info msg="Instance manager state is updated from starting to running after syncing with the pod" controller=longhorn-instance-manager instanceManager=instance-manager-e-3e00c51c node=ti76 nodeID=ti76
> [longhorn-manager-9xpwb] time="2022-05-03T07:02:07Z" level=warning msg="Error syncing Longhorn instance manager longhorn-system/instance-manager-e-3e00c51c: fail to sync instance manager for longhorn-system/instance-manager-e-3e00c51c: failed to get version: rpc error: code = Unavailable desc = connection error: desc = \"transport: Error while dialing dial tcp 10.244.144.155:8500: connect: no route to host\""
> [longhorn-manager-9xpwb] time="2022-05-03T07:02:07Z" level=warning msg="Error syncing Longhorn instance manager longhorn-system/instance-manager-r-8500a7a8: fail to sync instance manager for longhorn-system/instance-manager-r-8500a7a8: failed to get version: rpc error: code = Unavailable desc = connection error: desc = \"transport: Error while dialing dial tcp 10.244.144.168:8500: connect: no route to host\"

So it looks like the instance manager pods can't reach each other ... 
That is quite strange because:

> [root@TH84 cpcantw]# k get pods -A -o wide|grep longhor|grep instance-manager|grep ti76
> longhorn-system   instance-manager-e-3e00c51c                              1/1     Running             0              19h     10.244.144.155   ti76   <none>           <none>
> longhorn-system   instance-manager-r-8500a7a8                              1/1     Running             0              19h     10.244.144.168   ti76   <none>           <none>
> [root@TH84 cpcantw]# 
> [root@TH84 cpcantw]# k exec -ti -n longhorn-system instance-manager-e-3e00c51c -- ss -an|grep LISTEN
> u_str LISTEN 0      32       /var/run/tgtd/socket.0 1162214              * 0                                                                                    
> tcp   LISTEN 0      128                     0.0.0.0:3260           0.0.0.0:*                                                                                    
> tcp   LISTEN 0      128                           *:8500                 *:*                                                                                    
> tcp   LISTEN 0      128                        [::]:3260              [::]:*                                                                                    
> [root@TH84 cpcantw]# k exec -ti -n longhorn-system instance-manager-r-8500a7a8 -- ss -an|grep LISTEN
> tcp    LISTEN  0       128                  *:8500              *:*             
> [root@TH84 cpcantw]# k exec -ti -n longhorn-system instance-manager-r-8500a7a8 -- ping 10.244.144.155
> PING 10.244.144.155 (10.244.144.155) 56(84) bytes of data.
> 64 bytes from 10.244.144.155: icmp_seq=1 ttl=63 time=0.171 ms
> ^C
> --- 10.244.144.155 ping statistics ---
> 1 packets transmitted, 1 received, 0% packet loss, time 0ms
> rtt min/avg/max/mdev = 0.171/0.171/0.171/0.000 ms
> [root@TH84 cpcantw]# 

So why does the instance-manager report 'no route to host' ?
And also, is that the cause why the pod is stuck in ContainerCreating?

Any hints/help?
Thanks in advance.

Note: I also attached the generated support bundle.

## Environment

 - Longhorn version: 1.2.4
 - Kubernetes version: 1.23.4
 - Node config
   - OS type and version: CentOS Linux 8
   - CPU per node: 2 (min. 18 cores per CPU + hyperthreading enabled)
   - Memory per node: 384 GB
   - Disk type
   - Network bandwidth and latency between the nodes: min. 1GB
 - Underlying Infrastructure (e.g. on AWS/GCE, EKS/GKE, VMWare/KVM, Baremetal): baremetal

## Additional context
[longhorn-support-bundle_84d44a3a-fa8e-48e2-a980-4f0726e60633_2022-05-03T07-16-45Z.zip](https://github.com/longhorn/longhorn/files/8608900/longhorn-support-bundle_84d44a3a-fa8e-48e2-a980-4f0726e60633_2022-05-03T07-16-45Z.zip)

**Comment by opstalj** [comment]
Already an update: I started a tcpdump from the longhorn-manager on ti76 and indeed, it seems it does not get a reply on the TCP SYN towards the instance-manager-r/e on ti76:

[root@TH84 ~]# k get pods -A -o wide|grep longhorn-manager|grep ti76
longhorn-system   longhorn-manager-9xpwb                                   1/1     Running             1 (19h ago)    19h     10.244.144.162   ti76   <none>           <none>
[root@TH84 ~]#

> 09:46:36.979094 IP 10.244.144.162.33890 > 10.244.144.155.8500: Flags [S], seq 944077542, win 25380, options [mss 8460,sackOK,TS val 177584370 ecr 0,nop,wscale 7], length 0
> 09:46:36.979149 IP 10.244.144.162.35096 > 10.244.144.168.8500: Flags [S], seq 2365488599, win 25380, options [mss 8460,sackOK,TS val 3061026607 ecr 0,nop,wscale 7], length 0
> 09:46:38.034650 IP 10.244.144.162.33890 > 10.244.144.155.8500: Flags [S], seq 944077542, win 25380, options [mss 8460,sackOK,TS val 177585426 ecr 0,nop,wscale 7], length 0
> 09:46:38.034680 IP 10.244.144.162.35096 > 10.244.144.168.8500: Flags [S], seq 2365488599, win 25380, options [mss 8460,sackOK,TS val 3061027663 ecr 0,nop,wscale 7], length 0
> 09:46:38.041061 IP 10.244.144.162.33896 > 10.244.144.155.8500: Flags [S], seq 1498692118, win 25380, options [mss 8460,sackOK,TS val 177585432 ecr 0,nop,wscale 7], length 0
> 09:46:38.041093 IP 10.244.144.162.35102 > 10.244.144.168.8500: Flags [S], seq 3177448280, win 25380, options [mss 8460,sackOK,TS val 3061027669 ecr 0,nop,wscale 7], length 0

A plain ping to the instance-managers works ok:

> [root@TH84 ~]# k exec -ti -n longhorn-system longhorn-manager-9xpwb -- ping 10.244.144.155
> PING 10.244.144.155 (10.244.144.155) 56(84) bytes of data.
> 64 bytes from 10.244.144.155: icmp_seq=1 ttl=63 time=0.267 ms
> ^C
> --- 10.244.144.155 ping statistics ---
> 1 packets transmitted, 1 received, 0% packet loss, time 0ms
> rtt min/avg/max/mdev = 0.267/0.267/0.267/0.000 ms
> [root@TH84 ~]# 
> [root@TH84 ~]# k exec -ti -n longhorn-system longhorn-manager-9xpwb -- ping 10.244.144.168
> PING 10.244.144.168 (10.244.144.168) 56(84) bytes of data.
> 64 bytes from 10.244.144.168: icmp_seq=1 ttl=63 time=0.209 ms
> 64 bytes from 10.244.144.168: icmp_seq=2 ttl=63 time=0.103 ms
> ^C
> --- 10.244.144.168 ping statistics ---
> 2 packets transmitted, 2 received, 0% packet loss, time 1010ms
> rtt min/avg/max/mdev = 0.103/0.156/0.209/0.053 ms
> [root@TH84 ~]# 

Any idea why the traffic to port  8500 to the instance-managers can get dropped?
Thanks in advance.

**Comment by opstalj** [comment]
Also, an extra comment: I disabled node ti76, since I could not get a running Replica there ... when I created a volume and ti76 had to take care of a Replica, it just remained in 'Stopped' state and the volume does never get attached ...

![image](https://user-images.githubusercontent.com/12182338/166421707-fa6e8143-47a4-47fe-87e8-f8fb28627bba.png)

I tried to delete the ti76 (hoping the Replica would then be scheduled to another node), but nothing happens when I do that...

Kind regards.

**Comment by opstalj** [comment]
Hi,
Ticket can be closed.
Reason of failure: firewalld was still enabled on certain worker nodes and this caused communication failure (dropped packets) ... After stopping firewalld, longhorn started working as expeced.
