### ISSUE TITLE
[BUG] Volume stuck in an attach/detach loop

### ISSUE THREAD

**Issue by BogdanIonesq** [longhorn/longhorn#2259]
**Describe the bug**
When trying to attach a volume, either by using the UI or `kubectl` commands, it remains stuck in an attach/detach loop. 

**To Reproduce**
1. Go to Longhorn UI > Volume.
2. Click on 'Create Volume'. Use a random name, size 1Gi, everything else left on default. Click 'OK'.
3. Try to attach the newly created volume to any node.
4. See error: volume stuck in attaching/detaching loop.

**Expected behavior**
The volume should be successfully attached to the desired node.

**Log**
Relevant logs appear on the `instance-manager-e` on the node to which the volume should be attaching:
```
[test-volume-e-fe077bd4] time="2021-02-15T14:40:52Z" level=info msg="Shutdown SCSI device for target iqn.2019-10.io.longhorn:test-volume"
[test-volume-e-fe077bd4] time="2021-02-15T14:40:53Z" level=info msg="device test-volume: SCSI device /dev/longhorn/test-volume shutdown"
[longhorn-instance-manager] time="2021-02-15T14:40:53Z" level=info msg="wait for gRPC service of process test-volume-e-fe077bd4 to start at localhost:10000"
[test-volume-e-fe077bd4] go-iscsi-helper: tgtd is already running
[test-volume-e-fe077bd4] time="2021-02-15T14:40:54Z" level=info msg="go-iscsi-helper: found available target id 1"
tgtd: device_mgmt(246) sz:79 params:path=/var/run/longhorn-test-volume.sock,bstype=longhorn,bsopts=size=1073741824
tgtd: bs_thread_open(409) 16
[test-volume-e-fe077bd4] time="2021-02-15T14:40:54Z" level=info msg="New data socket connnection established"
[test-volume-e-fe077bd4] time="2021-02-15T14:40:54Z" level=info msg="default: automatically rescan all LUNs of all iscis sessions"
[longhorn-instance-manager] time="2021-02-15T14:40:54Z" level=info msg="wait for gRPC service of process test-volume-e-fe077bd4 to start at localhost:10000"
[longhorn-instance-manager] time="2021-02-15T14:40:55Z" level=info msg="wait for gRPC service of process test-volume-e-fe077bd4 to start at localhost:10000"
[longhorn-instance-manager] time="2021-02-15T14:40:56Z" level=info msg="wait for gRPC service of process test-volume-e-fe077bd4 to start at localhost:10000"
[longhorn-instance-manager] time="2021-02-15T14:40:57Z" level=info msg="wait for gRPC service of process test-volume-e-fe077bd4 to start at localhost:10000"
[longhorn-instance-manager] time="2021-02-15T14:40:59Z" level=info msg="wait for gRPC service of process test-volume-e-fe077bd4 to start at localhost:10000"
[longhorn-instance-manager] time="2021-02-15T14:41:00Z" level=info msg="wait for gRPC service of process test-volume-e-fe077bd4 to start at localhost:10000"
[longhorn-instance-manager] time="2021-02-15T14:41:01Z" level=info msg="wait for gRPC service of process test-volume-e-fe077bd4 to start at localhost:10000"
[longhorn-instance-manager] time="2021-02-15T14:41:02Z" level=info msg="wait for gRPC service of process test-volume-e-fe077bd4 to start at localhost:10000"
[longhorn-instance-manager] time="2021-02-15T14:41:03Z" level=info msg="wait for gRPC service of process test-volume-e-fe077bd4 to start at localhost:10000"
[longhorn-instance-manager] time="2021-02-15T14:41:04Z" level=info msg="wait for gRPC service of process test-volume-e-fe077bd4 to start at localhost:10000"
[test-volume-e-fe077bd4] time="2021-02-15T14:41:04Z" level=error msg="Failed to startup frontend: Cannot find iscsi device"
[test-volume-e-fe077bd4] 2021/02/15 14:41:04 failed to start up frontend: Cannot find iscsi device_mgmt
```

**Environment:**
 - Longhorn version: v1.1.0
 - Kubernetes version: v1.20.2 (1 master node, 2 workers)
 - Node config
   - OS type and version: CentOS 8
   - CPU per node: 8
   - Memory per node: 16Gi
 - Underlying Infrastructure: VMWare
 - Number of Longhorn volumes in the cluster: just the one trying to attach (fresh install)

**Additional context**
- Cluster is IPv6 only.
- Attaching a volume with ISCSI frontend mode works.
- On each node, `/var/lib/longhorn` is using a separate 16Gi disk (i.e. `mount /dev/sdb /var/lib/longhorn`)
- Environment check script was successful.
- Open-iSCSI is running on all the nodes. Here are the logs from the node to which I was trying to attach the volume:
```
# systemctl status iscsid --full --no-pager
● iscsid.service - Open-iSCSI
   Loaded: loaded (/usr/lib/systemd/system/iscsid.service; disabled; vendor preset: disabled)
   Active: active (running) since Wed 2021-02-10 17:52:37 EET; 5 days ago
     Docs: man:iscsid(8)
           man:iscsiuio(8)
           man:iscsiadm(8)
 Main PID: 2717878 (iscsid)
   Status: "Ready to process requests"
    Tasks: 1 (limit: 101102)
   Memory: 4.7M
   CGroup: /system.slice/iscsid.service
           └─2717878 /usr/sbin/iscsid -f

Feb 15 16:41:41 k8-node2.axigen.lan iscsid[2717878]: iscsid: Connection83:0 to [target: iqn.2019-10.io.longhorn:test-volume, portal: fc00::30:0:0:bafd,3260] through [iface: default] is shutdown.
Feb 15 16:41:42 k8-node2.axigen.lan iscsid[2717878]: iscsid: Connection84:0 to [target: iqn.2019-10.io.longhorn:test-volume, portal: fc00::30:0:0:bafd,3260] through [iface: default] is operational now
Feb 15 16:41:57 k8-node2.axigen.lan iscsid[2717878]: iscsid: Connection84:0 to [target: iqn.2019-10.io.longhorn:test-volume, portal: fc00::30:0:0:bafd,3260] through [iface: default] is shutdown.
Feb 15 16:41:59 k8-node2.axigen.lan iscsid[2717878]: iscsid: Connection85:0 to [target: iqn.2019-10.io.longhorn:test-volume, portal: fc00::30:0:0:bafd,3260] through [iface: default] is operational now
Feb 15 16:42:14 k8-node2.axigen.lan iscsid[2717878]: iscsid: Connection85:0 to [target: iqn.2019-10.io.longhorn:test-volume, portal: fc00::30:0:0:bafd,3260] through [iface: default] is shutdown.
Feb 15 16:42:15 k8-node2.axigen.lan iscsid[2717878]: iscsid: Connection86:0 to [target: iqn.2019-10.io.longhorn:test-volume, portal: fc00::30:0:0:bafd,3260] through [iface: default] is operational now
Feb 15 16:42:30 k8-node2.axigen.lan iscsid[2717878]: iscsid: Connection86:0 to [target: iqn.2019-10.io.longhorn:test-volume, portal: fc00::30:0:0:bafd,3260] through [iface: default] is shutdown.
Feb 15 16:42:31 k8-node2.axigen.lan iscsid[2717878]: iscsid: Connection87:0 to [target: iqn.2019-10.io.longhorn:test-volume, portal: fc00::30:0:0:bafd,3260] through [iface: default] is operational now
Feb 15 16:42:46 k8-node2.axigen.lan iscsid[2717878]: iscsid: Connection87:0 to [target: iqn.2019-10.io.longhorn:test-volume, portal: fc00::30:0:0:bafd,3260] through [iface: default] is shutdown.
Feb 15 16:42:47 k8-node2.axigen.lan iscsid[2717878]: iscsid: Connection88:0 to [target: iqn.2019-10.io.longhorn:test-volume, portal: fc00::30:0:0:bafd,3260] through [iface: default] is operational now
```
[SupportBundle.zip](https://github.com/longhorn/longhorn/files/5987014/SupportBundle.zip)

**Comment by joshimoo** [comment]
Might be related to the ip v6 only cluster, more investigation needed.
@BogdanIonesq Can you attach a support bundle?

**Comment by BogdanIonesq** [comment]
@joshimoo the support bundle is attached to the end of the post

**Comment by joshimoo** [comment]
@BogdanIonesq We currently don't fully support ipv6 only clusters, it's something we want to look into in the future.

**Comment by StarAurryon** [comment]
@joshimoo What is the current status on IPv6 only cluster. I could help by making PRs.

We have a full IPv6 network and kubernetes with nat64 as dual stack kubernetes was in beta state whereas IPv6 was not.

**Comment by TrooperT** [comment]
I am also curious as to the status of longhorn supporting an ipv6 only cluster.

**Comment by peter-koenig** [comment]
Hello @joshimoo!

Any updates on IPv6-only clusters?
We are facing the same issue with an AWS EKS IPv6 cluster, with VPC DualStack.

Thank you!

**Comment by StarAurryon** [comment]
@joshimoo Any news ?

**Comment by vanlueckn** [comment]
@joshimoo Any news on this?

**Comment by StarAurryon** [comment]
Bump

**Comment by hamamini** [comment]
Do you have any plan to support Kubernetes IPv6-only clusters!!?

**Comment by cnb2412** [comment]
There's probably no news in this regard. However, I also want to emphazise that support of Kubernetes IPv6-only is urgently needed imho.

**Comment by alpeshbhavsar** [comment]
By when can we expect support for IPv6 only?

**Comment by rgaduput** [comment]
Hi,
any idea by when can we expect the support for IPv6 only clusters ?

**Comment by innobead** [comment]
> Hi, any idea by when can we expect the support for IPv6 only clusters ?

No plan for the upcoming 1.4, but we probably can revisit this in 1.5 or 1.6 by seeing if the resource is enough. Seeing more feedback on this.

**Comment by alonkrispin43** [comment]
do we know when this release 1.5/6 will be publish , as this is hugh issue as i can see , how come dual stack is supported and pure ipv6 is not , can someone escalate this issue ? 
i have issue when trying using promstack with longhorn on pure ipv6 on k8s 1.22 ,  issue that  prom can't use the stoarge class even if it's bound .

**Comment by QuinnJensen** [comment]
@innobead Thank you for moving this to 1.7.0!  Yay!

**Comment by SchulteMK** [comment]
@innobead can you please explain why this important issue was removed from the 1.7 milestone?

**Comment by derekbit** [comment]
After discussing with @c3y1huang, we will have 4 phases

- [ ] v1 evaluation
- [ ] v1 implementation

- [ ] v2 evaluation
- [ ] v2 implementation

Besides, we need to make our infra support IPv6.

cc @longhorn/qa @khushboo-rancher @jbrockmeyer @innobead

**Comment by c3y1huang** [comment]
Notes about setting up the **test bed** for IPv6 **storage network** scenario with the Flannel + IPvlan on AWS EC2 instances.

**Findings:**
1. **IPv6 NDP Failure:** Unlike IPv4, which uses ARP for neighbor discovery, IPv6 relies on NDP to resolve on-link addresses and identify routers (gateways). Although the IPvlan interface is configured in L3 mode, the pod fails to resolve the gateway address via NDP, so no outbound traffic.
1. **Unidirectional Traffic Flow:** I've tried manually adding the IPv6 gateway route on the host's secondary network interface. And observed that ICMPv6 echo requests arriving at the destination pod, but there is no reply:
    ```bash
    10:10:02.547433 IP6 fd00:168:1::1 > fd00:168:3::4: ICMP6, echo request, id 11, seq 1, length 64
    10:10:03.562333 IP6 fd00:168:1::1 > fd00:168:3::4: ICMP6, echo request, id 11, seq 2, length 64
    10:10:04.586328 IP6 fd00:168:1::1 > fd00:168:3::4: ICMP6, echo request, id 11, seq 3, length 64
    ```
    This suggests that the pod can receive traffic, but the kernel dropped the outgoing packets because no NDP was found for the gateway.
1. **Manually Route:** To validate the issue, I added a static route to the gateway inside the pod. This restores the bidirectional connection, confirming that the issue is that the pod cannot resolve the gateway address via NDP.
1. **CNI Limitations:** So the manual fix works, but it's not practical. Attempts to configure `routes` in the NAD for the IPvlan were unsuccessful, likely due to Flannel CNI overriding or ignoring custom route settings.
1. **AWS EC2 MAC Address Constraints:** AWS EC2 does not allow assigning multiple MAC addresses per ENI. This rules out L2-mode CNI that depends on unique MACs per pod. While IPvlan L3 avoids MAC duplication, it suffers from NDP issues.
---
**Summary:**
In Longhorn, the logic for retrieving the storage IP is the same for both the cluster network and a secondary Multus-managed network. This means that if IPv6 works on the cluster network, it should also work on the storage network.

Validating this assumption is challenging, as setting up an IPv6 storage network test bed on AWS EC2 instances is difficult using the existing upstream CNI plugins. However, since we know the cause and identified a functional workaround, we can workaround this limitation by patching the IPvlan CNI plugin to include the workaround for testing purposes and to move things forward.

https://github.com/c3y1huang/cni-plugins/commit/6888978526ea53ca3a8b04fc9a56f47321f3dda5

**Comment by CFSworks** [comment]
I am not really a Go programmer or I'd PR this, but I thought I'd share the patches I use to enable support on my IPv6-only cluster. They basically fall into two categories:

1. **Use `net.JoinHostPort(host, port)` instead of `fmt.Sprintf("%s:%s", host, port)`** - this is because IPv6 notation requires bracketing around the address portion.

<details>
<summary>go-iscsi-helper patch</summary>

```diff
commit 838810f55664458b34851b5a152e398b371df91b
Author: Sam Edwards <CFSworks@gmail.com>
Date:   Thu Jun 19 19:19:43 2025 +0000

    Fix handling of IPv6 address:port strings

diff --git a/iscsi/initiator.go b/iscsi/initiator.go
index abe4c77..d10befb 100644
--- a/iscsi/initiator.go
+++ b/iscsi/initiator.go
@@ -3,6 +3,7 @@ package iscsi
 import (
        "bufio"
        "fmt"
+       "net"
        "path/filepath"
        "strconv"
        "strings"
@@ -186,7 +187,7 @@ func IsTargetLoggedIn(ip, target string, nsexec *lhns.Executor) bool {
        scanner := bufio.NewScanner(strings.NewReader(output))
        for scanner.Scan() {
                line := scanner.Text()
-               if strings.Contains(line, ip+":") {
+               if strings.Contains(line, net.JoinHostPort(ip, "")) {
                        if strings.HasSuffix(line, " "+target) ||
                                strings.Contains(scanner.Text(), " "+target+" ") {
                                found = true
@@ -253,7 +254,7 @@ func findScsiDevice(ip, target string, lun int, nsexec *lhns.Executor) (*lhtypes
        */
        scanner := bufio.NewScanner(strings.NewReader(output))
        targetLine := "Target: " + target
-       ipLine := " " + ip + ":"
+       ipLine := " " + net.JoinHostPort(ip, "")
        lunLine := "Lun: " + strconv.Itoa(lun)
        diskPrefix := "Attached scsi disk"
        stateLine := "State:"
```
</details>

<details>
<summary>longhorn-manager patch</summary>

```diff
commit f67bfcb5639bb545e042a9b40eccc89c6879d6f8
Author: Sam Edwards <CFSworks@gmail.com>
Date:   Fri Jun 20 18:13:51 2025 +0000

    Use `net.JoinHostPort(...)` instead of `fmt.Sprintf("%s:%d", ...)`
    
    Not only is this clearer about purpose, it handles IPv6 [...]:1234 bracketing properly.

diff --git a/api/forwarder.go b/api/forwarder.go
index 916a3d350..dd799d168 100644
--- a/api/forwarder.go
+++ b/api/forwarder.go
@@ -2,9 +2,11 @@ package api
 
 import (
        "fmt"
+       "net"
        "net/http"
        "net/http/httputil"
        "net/url"
+       "strconv"
 
        "github.com/gorilla/mux"
        "github.com/pkg/errors"
@@ -205,7 +207,7 @@ func UploadParametersForBackingImage(m *manager.VolumeManager) func(req *http.Re
                if bids.Status.CurrentState != longhorn.BackingImageStatePending {
                        return nil, fmt.Errorf("upload server for backing image %s has not been initiated", name)
                }
-               return map[string]string{ParameterKeyAddress: fmt.Sprintf("%s:%d", pod.Status.PodIP, engineapi.BackingImageDataSourceDefaultPort)}, nil
+               return map[string]string{ParameterKeyAddress: net.JoinHostPort(pod.Status.PodIP, strconv.Itoa(engineapi.BackingImageDataSourceDefaultPort))}, nil
        }
 }
 
diff --git a/controller/backing_image_data_source_controller.go b/controller/backing_image_data_source_controller.go
index f478c81f5..b54fa30ff 100644
--- a/controller/backing_image_data_source_controller.go
+++ b/controller/backing_image_data_source_controller.go
@@ -3,6 +3,7 @@ package controller
 import (
        "encoding/json"
        "fmt"
+       "net"
        "reflect"
        "strconv"
        "strings"
@@ -942,7 +943,7 @@ func (c *BackingImageDataSourceController) prepareRunningParametersForExport(bid
                        continue
                }
                rAddress := e.Status.CurrentReplicaAddressMap[rName]
-               if rAddress == "" || rAddress != fmt.Sprintf("%s:%d", r.Status.StorageIP, r.Status.Port) {
+               if rAddress == "" || rAddress != net.JoinHostPort(r.Status.StorageIP, strconv.Itoa(r.Status.Port)) {
                        continue
                }
                bids.Status.RunningParameters[longhorn.DataSourceTypeExportFromVolumeParameterSenderAddress] = rAddress
diff --git a/controller/backing_image_manager_controller.go b/controller/backing_image_manager_controller.go
index e17d0b142..af1606b6b 100644
--- a/controller/backing_image_manager_controller.go
+++ b/controller/backing_image_manager_controller.go
@@ -3,7 +3,9 @@ package controller
 import (
        "encoding/json"
        "fmt"
+       "net"
        "reflect"
+       "strconv"
        "sync"
        "time"
 
@@ -709,7 +711,7 @@ func (c *BackingImageManagerController) prepareBackingImageFiles(currentBIM *lon
                                continue
                        }
                        log.Infof("Starting to fetch the data source file from the backing image data source work directory %v", bimtypes.DataSourceDirectoryName)
-                       if _, err := cli.Fetch(biRO.Name, biRO.Status.UUID, bids.Status.Checksum, fmt.Sprintf("%s:%d", bids.Status.StorageIP, engineapi.BackingImageDataSourceDefaultPort), bids.Status.Size); err != nil {
+                       if _, err := cli.Fetch(biRO.Name, biRO.Status.UUID, bids.Status.Checksum, net.JoinHostPort(bids.Status.StorageIP, strconv.Itoa(engineapi.BackingImageDataSourceDefaultPort)), bids.Status.Size); err != nil {
                                if types.ErrorAlreadyExists(err) {
                                        continue
                                }
diff --git a/engineapi/backing_image_data_source.go b/engineapi/backing_image_data_source.go
index 0271f9586..568240892 100644
--- a/engineapi/backing_image_data_source.go
+++ b/engineapi/backing_image_data_source.go
@@ -1,7 +1,8 @@
 package engineapi
 
 import (
-       "fmt"
+       "net"
+       "strconv"
 
        bimapi "github.com/longhorn/backing-image-manager/api"
        bimclient "github.com/longhorn/backing-image-manager/pkg/client"
@@ -30,7 +31,7 @@ type BackingImageDataSourceClient struct {
 func NewBackingImageDataSourceClient(ip string) *BackingImageDataSourceClient {
        return &BackingImageDataSourceClient{
                bimclient.DataSourceClient{
-                       Remote: fmt.Sprintf("%s:%d", ip, BackingImageDataSourceDefaultPort),
+                       Remote: net.JoinHostPort(ip, strconv.Itoa(BackingImageDataSourceDefaultPort)),
                },
        }
 }
diff --git a/engineapi/backing_image_manager.go b/engineapi/backing_image_manager.go
index 874a7c42e..44bb44531 100644
--- a/engineapi/backing_image_manager.go
+++ b/engineapi/backing_image_manager.go
@@ -2,6 +2,8 @@ package engineapi
 
 import (
        "fmt"
+       "net"
+       "strconv"
 
        bimapi "github.com/longhorn/backing-image-manager/api"
        bimclient "github.com/longhorn/backing-image-manager/pkg/client"
@@ -45,7 +47,7 @@ func NewBackingImageManagerClient(bim *longhorn.BackingImageManager) (*BackingIm
                ip:            bim.Status.IP,
                apiMinVersion: bim.Status.APIMinVersion,
                apiVersion:    bim.Status.APIVersion,
-               grpcClient:    bimclient.NewBackingImageManagerClient(fmt.Sprintf("%s:%d", bim.Status.IP, BackingImageManagerDefaultPort)),
+               grpcClient:    bimclient.NewBackingImageManagerClient(net.JoinHostPort(bim.Status.IP, strconv.Itoa(BackingImageManagerDefaultPort))),
        }, nil
 }
 
@@ -84,7 +86,7 @@ func (c *BackingImageManagerClient) Sync(name, uuid, checksum, fromHost string,
        if err := CheckBackingImageManagerCompatibility(c.apiMinVersion, c.apiVersion); err != nil {
                return nil, err
        }
-       resp, err := c.grpcClient.Sync(name, uuid, checksum, fmt.Sprintf("%s:%d", fromHost, BackingImageManagerDefaultPort), size)
+       resp, err := c.grpcClient.Sync(name, uuid, checksum, net.JoinHostPort(fromHost, strconv.Itoa(BackingImageManagerDefaultPort)), size)
        if err != nil {
                return nil, err
        }
diff --git a/engineapi/share_manager.go b/engineapi/share_manager.go
index 083129da4..c22ad2b17 100644
--- a/engineapi/share_manager.go
+++ b/engineapi/share_manager.go
@@ -1,7 +1,8 @@
 package engineapi
 
 import (
-       "fmt"
+       "net"
+       "strconv"
 
        "github.com/pkg/errors"
 
@@ -17,7 +18,7 @@ type ShareManagerClient struct {
 }
 
 func NewShareManagerClient(sm *longhorn.ShareManager, pod *corev1.Pod) (*ShareManagerClient, error) {
-       client, err := smclient.NewShareManagerClient(fmt.Sprintf("%s:%d", pod.Status.PodIP, ShareManagerDefaultPort))
+       client, err := smclient.NewShareManagerClient(net.JoinHostPort(pod.Status.PodIP, strconv.Itoa(ShareManagerDefaultPort)))
        if err != nil {
                return nil, errors.Wrapf(err, "failed to create Share Manager client for %v", sm.Name)
        }
```
</details>

2. **Prefer listening on `:port` over `0.0.0.0:port`** - doing this allows Go to pick the protocol family according to system policy. On Linux, this creates an IPv6 socket that also accepts IPv4 connections. Windows will have to be tested separately.

<details>
<summary>longhorn-manager patch</summary>

```diff
commit b9bea122a7dffccbd4bd42d7ee7ccf637067ed93
Author: Sam Edwards <CFSworks@gmail.com>
Date:   Thu Jun 19 23:09:04 2025 +0000

    Do not bind to `0.0.0.0`, so as not to exclude IPv6

diff --git a/controller/backing_image_data_source_controller.go b/controller/backing_image_data_source_controller.go
index 33ed9b55d..f478c81f5 100644
--- a/controller/backing_image_data_source_controller.go
+++ b/controller/backing_image_data_source_controller.go
@@ -676,8 +676,8 @@ func (c *BackingImageDataSourceController) generateBackingImageDataSourcePodMani
        cmd := []string{
                "backing-image-manager", "--debug",
                "data-source",
-               "--listen", fmt.Sprintf("%s:%d", "0.0.0.0", engineapi.BackingImageDataSourceDefaultPort),
-               "--sync-listen", fmt.Sprintf("%s:%d", "0.0.0.0", engineapi.BackingImageSyncServerDefaultPort),
+               "--listen", fmt.Sprintf(":%d", engineapi.BackingImageDataSourceDefaultPort),
+               "--sync-listen", fmt.Sprintf(":%d", engineapi.BackingImageSyncServerDefaultPort),
                "--name", bids.Name,
                "--uuid", bids.Spec.UUID,
                "--source-type", string(bids.Spec.SourceType),
diff --git a/controller/backing_image_manager_controller.go b/controller/backing_image_manager_controller.go
index ed12ad7c1..e17d0b142 100644
--- a/controller/backing_image_manager_controller.go
+++ b/controller/backing_image_manager_controller.go
@@ -873,8 +873,8 @@ func (c *BackingImageManagerController) generateBackingImageManagerPodManifest(b
                                        Command: []string{
                                                "backing-image-manager", "--debug",
                                                "daemon",
-                                               "--listen", fmt.Sprintf("%s:%d", "0.0.0.0", engineapi.BackingImageManagerDefaultPort),
-                                               "--sync-listen", fmt.Sprintf("%s:%d", "0.0.0.0", engineapi.BackingImageSyncServerDefaultPort),
+                                               "--listen", fmt.Sprintf(":%d", engineapi.BackingImageManagerDefaultPort),
+                                               "--sync-listen", fmt.Sprintf(":%d", engineapi.BackingImageSyncServerDefaultPort),
                                        },
                                        ReadinessProbe: &corev1.Probe{
                                                ProbeHandler: corev1.ProbeHandler{
diff --git a/controller/instance_manager_controller.go b/controller/instance_manager_controller.go
index 4b192e333..45ca10e52 100644
--- a/controller/instance_manager_controller.go
+++ b/controller/instance_manager_controller.go
@@ -1500,7 +1500,7 @@ func (imc *InstanceManagerController) createInstanceManagerPodSpec(im *longhorn.
                        "--enable-spdk", "--debug",
                        "daemon",
                        "--spdk-enabled",
-                       "--listen", fmt.Sprintf("0.0.0.0:%d", engineapi.InstanceManagerProcessManagerServiceDefaultPort)}
+                       "--listen", fmt.Sprintf(":%d", engineapi.InstanceManagerProcessManagerServiceDefaultPort)}
 
                imc.logger.Infof("Creating instance manager pod %v with args %+v", podSpec.Name, args)
 
@@ -1529,7 +1529,7 @@ func (imc *InstanceManagerController) createInstanceManagerPodSpec(im *longhorn.
                }
        } else {
                podSpec.Spec.Containers[0].Args = []string{
-                       "instance-manager", "--debug", "daemon", "--listen", fmt.Sprintf("0.0.0.0:%d", engineapi.InstanceManagerProcessManagerServiceDefaultPort),
+                       "instance-manager", "--debug", "daemon", "--listen", fmt.Sprintf(":%d", engineapi.InstanceManagerProcessManagerServiceDefaultPort),
                }
        }
 
diff --git a/engineapi/instance_manager.go b/engineapi/instance_manager.go
index 6e450178f..acf0c7d31 100644
--- a/engineapi/instance_manager.go
+++ b/engineapi/instance_manager.go
@@ -35,7 +35,7 @@ const (
        DefaultReplicaPortCountV1 = 10
        DefaultReplicaPortCountV2 = 5
 
-       DefaultPortArg         = "--listen,0.0.0.0:"
+       DefaultPortArg         = "--listen,:"
        DefaultTerminateSignal = "SIGHUP"
 
        // IncompatibleInstanceManagerAPIVersion means the instance manager version in v0.7.0
```
</details>

**Comment by c3y1huang** [comment]
**PoC Phase Test Results**
- **Core Tests**
	- **Cluster Network**
        - S3 Backupstore
            ```bash
            === 64 passed, 1 skipped, 325 deselected, 45 warnings in 9809.10s (2:43:29) ====
            ```
    - **Storage Network**
        - S3 Backupstore
            ```bash
			=== 64 passed, 1 skipped, 325 deselected, 46 warnings in 9573.32s (2:39:33) ====
			```
        - NFS Backupstore
			```bash
			======== 65 passed, 325 deselected, 46 warnings in 10566.67s (2:56:06) =========
            ```
- **Full Regression**
	- **Cluster Network**
        - S3 Backupstore
      		```bash
			======== 370 passed, 20 skipped, 443 warnings in 67325.95s (18:42:05) =========
			```

**Comment by c3y1huang** [comment]
**PRs Test Results (Full Regression WIP)**
- **IPv4**
	- S3 Backupstore:
		- https://ci.longhorn.io/job/private/job/longhorn-tests-regression/8846/
		- https://ci.longhorn.io/job/private/job/longhorn-tests-regression/8847/
		- https://ci.longhorn.io/job/private/job/longhorn-tests-regression/8850/
	- NFS Backupstore:
		- https://ci.longhorn.io/job/private/job/longhorn-tests-regression/8848/
		- https://ci.longhorn.io/job/private/job/longhorn-tests-regression/8852/
		- https://ci.longhorn.io/job/private/job/longhorn-tests-regression/8853/
- **IPv6**
	- **Cluster Network**
		- S3 Backupstore:
			```
            ====== 370 passed, 20 skipped, 452 warnings in 72332.14s (20:05:32) ======
			```
		- NFS Backupstore:
			```
			====== 369 passed, 21 skipped, 589 warnings in 70264.03s (19:31:04) ======
			```
	- **Storage Network**
		- S3 Backupstore:
			```
			====== 370 passed, 20 skipped, 439 warnings in 69521.16s (19:18:41) ======
			```
		- NFS Backupstore:
			```
			====== 369 passed, 21 skipped, 486 warnings in 69996.32s (19:26:36) ======
			```

**Comment by yangchiu** [comment]
While testing this feature based on refined terraform scripts from https://github.com/longhorn/longhorn-tests/pull/2606, and run the test case `test_engine_live_upgrade` or manually run the following test steps:

1. Create `ipv6` k3s cluster:
```
$ kubectl get nodes -owide
NAME            STATUS   ROLES                  AGE   VERSION        INTERNAL-IP                               EXTERNAL-IP   OS-IMAGE                              KERNEL-VERSION               CONTAINER-RUNTIME
ip-10-0-1-178   Ready    <none>                 20s   v1.33.0+k3s1   2600:1f18:51dd:4600:c40e:b9d4:14e4:3233   <none>        SUSE Linux Enterprise Server 15 SP6   6.4.0-150600.23.47-default   containerd://2.0.4-k3s4
ip-10-0-1-191   Ready    <none>                 19s   v1.33.0+k3s1   2600:1f18:51dd:4600:9702:c182:848:adbd    <none>        SUSE Linux Enterprise Server 15 SP6   6.4.0-150600.23.47-default   containerd://2.0.4-k3s4
ip-10-0-1-232   Ready    <none>                 18s   v1.33.0+k3s1   2600:1f18:51dd:4600:e02d:3312:8268:59bc   <none>        SUSE Linux Enterprise Server 15 SP6   6.4.0-150600.23.47-default   containerd://2.0.4-k3s4
ip-10-0-1-72    Ready    control-plane,master   27s   v1.33.0+k3s1   2600:1f18:51dd:4600:fe88:d8c0:e199:d627   <none>        SUSE Linux Enterprise Server 15 SP6   6.4.0-150600.23.47-default   containerd://2.0.4-k3s4
```

2. Install Longhorn:
```
$ kubectl get pods -n longhorn-system -owide
NAME                                                READY   STATUS    RESTARTS       AGE     IP                NODE            NOMINATED NODE   READINESS GATES
csi-attacher-5d68b48d9-6d6m8                        1/1     Running   0              58s     fd00:10:0:3::b    ip-10-0-1-232   <none>           <none>
csi-attacher-5d68b48d9-fcwl8                        1/1     Running   0              58s     fd00:10:0:1::c    ip-10-0-1-178   <none>           <none>
csi-attacher-5d68b48d9-hssd7                        1/1     Running   0              58s     fd00:10:0:2::a    ip-10-0-1-191   <none>           <none>
csi-provisioner-6fcc6478db-fkgch                    1/1     Running   0              58s     fd00:10:0:2::b    ip-10-0-1-191   <none>           <none>
csi-provisioner-6fcc6478db-l7t96                    1/1     Running   0              58s     fd00:10:0:1::d    ip-10-0-1-178   <none>           <none>
csi-provisioner-6fcc6478db-zmpk8                    1/1     Running   0              58s     fd00:10:0:3::a    ip-10-0-1-232   <none>           <none>
csi-resizer-6c558c9fbc-h78pq                        1/1     Running   0              58s     fd00:10:0:1::f    ip-10-0-1-178   <none>           <none>
csi-resizer-6c558c9fbc-mgfkm                        1/1     Running   0              58s     fd00:10:0:2::c    ip-10-0-1-191   <none>           <none>
csi-resizer-6c558c9fbc-s6dsk                        1/1     Running   0              58s     fd00:10:0:3::d    ip-10-0-1-232   <none>           <none>
csi-snapshotter-874b9f887-5hjqb                     1/1     Running   0              58s     fd00:10:0:1::e    ip-10-0-1-178   <none>           <none>
csi-snapshotter-874b9f887-dds46                     1/1     Running   0              58s     fd00:10:0:3::c    ip-10-0-1-232   <none>           <none>
csi-snapshotter-874b9f887-mwsf2                     1/1     Running   0              58s     fd00:10:0:2::d    ip-10-0-1-191   <none>           <none>
engine-image-ei-b907910b-br6dw                      1/1     Running   0              117s    fd00:10:0:1::a    ip-10-0-1-178   <none>           <none>
engine-image-ei-b907910b-c79m4                      1/1     Running   0              117s    fd00:10:0:2::7    ip-10-0-1-191   <none>           <none>
engine-image-ei-b907910b-c895j                      1/1     Running   0              117s    fd00:10:0:3::7    ip-10-0-1-232   <none>           <none>
instance-manager-6a55178a8f8411dc8e7c5283b57d7303   1/1     Running   0              86s     fd00:10:0:3::8    ip-10-0-1-232   <none>           <none>
instance-manager-b73c42c69cfe8f3002324cb314f267b8   1/1     Running   0              81s     fd00:10:0:2::8    ip-10-0-1-191   <none>           <none>
instance-manager-cde74f08b9fa944fed3f4ec36d0212c6   1/1     Running   0              88s     fd00:10:0:1::b    ip-10-0-1-178   <none>           <none>
longhorn-csi-plugin-87ml5                           3/3     Running   0              58s     fd00:10:0:1::10   ip-10-0-1-178   <none>           <none>
longhorn-csi-plugin-dfscn                           3/3     Running   0              58s     fd00:10:0:3::e    ip-10-0-1-232   <none>           <none>
longhorn-csi-plugin-x5pxl                           3/3     Running   0              58s     fd00:10:0:2::e    ip-10-0-1-191   <none>           <none>
longhorn-driver-deployer-5f44b4dc59-9sr8t           1/1     Running   0              2m16s   fd00:10:0:2::6    ip-10-0-1-191   <none>           <none>
longhorn-manager-d8dm8                              2/2     Running   1 (2m6s ago)   2m17s   fd00:10:0:3::5    ip-10-0-1-232   <none>           <none>
longhorn-manager-ndllx                              2/2     Running   0              2m17s   fd00:10:0:1::8    ip-10-0-1-178   <none>           <none>
longhorn-manager-tbwfw                              2/2     Running   0              2m17s   fd00:10:0:2::5    ip-10-0-1-191   <none>           <none>
longhorn-ui-f7ff9c74-58rtn                          1/1     Running   0              2m15s   fd00:10:0:1::9    ip-10-0-1-178   <none>           <none>
longhorn-ui-f7ff9c74-xw298                          1/1     Running   0              2m15s   fd00:10:0:3::6    ip-10-0-1-232   <none>           <none>
```

3. Create an additional engine image:
![Image](https://github.com/user-attachments/assets/1cfc6262-7719-4cd6-ace9-9fce565470ce)

4. Create a volume with `2` replicas on `node 0` and `node 1`, and attach the volume to `node 2`:
![Image](https://github.com/user-attachments/assets/b0cb769b-5f0a-4a67-9090-4df929000dfe)

5. Upgrade the volume to the engine image:
![Image](https://github.com/user-attachments/assets/651f80a1-d2ad-4d75-9d54-10bdff78ad08)

6. The volume is stuck in `upgrading` indefinitely:
![Image](https://github.com/user-attachments/assets/e88f2386-440a-4c39-9b8f-bada0942b649)

with error messages in `instance-manager`:
```
2025-07-02T01:55:41.955213916Z time="2025-07-02T01:55:41Z" level=info msg="Connecting to remote: [fd00:10:0:1::b]:10010 (tcp)" func="remote.(*Factory).Create" file="remote.go:394"
2025-07-02T01:55:41.958594947Z [test-1-e-0] time="2025-07-02T01:55:41Z" level=warning msg="Failed to create backend with address tcp://[fd00:10:0:1::b]:10010" func="controller.(*Controller).Start" file="control.go:908" error="replica must be closed, cannot add in state: dirty"
2025-07-02T01:55:41.958637054Z time="2025-07-02T01:55:41Z" level=info msg="Connecting to remote: [fd00:10:0:3::8]:10010 (tcp)" func="remote.(*Factory).Create" file="remote.go:394"
2025-07-02T01:55:41.967723236Z [test-1-e-0] time="2025-07-02T01:55:41Z" level=warning msg="Failed to create backend with address tcp://[fd00:10:0:3::8]:10010" func="controller.(*Controller).Start" file="control.go:908" error="replica must be closed, cannot add in state: dirty"
2025-07-02T01:55:41.969557233Z [test-1-e-0] time="2025-07-02T01:55:41Z" level=info msg="Adding backend: tcp://[fd00:10:0:1::b]:10010" func="controller.(*replicator).AddBackend" file="replicator.go:58"
2025-07-02T01:55:41.969569205Z time="2025-07-02T01:55:41Z" level=info msg="Adding backend: tcp://[fd00:10:0:3::8]:10010" func="controller.(*replicator).AddBackend" file="replicator.go:58"
2025-07-02T01:55:41.969573171Z time="2025-07-02T01:55:41Z" level=error msg="no available backend due to replica error from the addresses [tcp://[fd00:10:0:1::b]:10010 tcp://[fd00:10:0:3::8]:10010]" func=cmd.startController file="controller.go:218"
2025-07-02T01:55:41.971187687Z [longhorn-instance-manager] time="2025-07-02T01:55:41Z" level=info msg="Process Manager: process test-1-e-0 error out, error msg: exit status 61" func="process.(*Process).Start.func1" file="process.go:70"
2025-07-02T01:55:41.971198055Z [longhorn-instance-manager] time="2025-07-02T01:55:41Z" level=warning msg="Process update: test-1-e-0: state error: errorMsg: exit status 61" func="process.(*Process).RPCResponse" file="process.go:115"
2025-07-02T01:55:41.971286892Z [longhorn-instance-manager] time="2025-07-02T01:55:41Z" level=info msg="Stop waiting for gRPC service of process test-1-e-0 to start at localhost:10005" func="process.(*GRPCHealthChecker).WaitForRunning" file="healthchecker.go:29"
2025-07-02T01:55:42.937165091Z [longhorn-instance-manager] time="2025-07-02T01:55:42Z" level=warning msg="Process update: test-1-e-0: state error: errorMsg: exit status 61" func="process.(*Process).RPCResponse" file="process.go:115"
2025-07-02T01:55:42.937197127Z [longhorn-instance-manager] time="2025-07-02T01:55:42Z" level=error msg="Process Manager: replacement process for test-1-e-0 failed to start, now in state error" func="process.(*Manager).ProcessReplace" file="process_manager.go:514"
2025-07-02T01:55:42.937204844Z [longhorn-instance-manager] time="2025-07-02T01:55:42Z" level=error msg="Process Manager: cleaned up the replacement process test-1-e-0 with UUID 0dd102ac-8cbd-4143-b668-2b57ed1ff996" func="process.(*Manager).ProcessReplace.func1" file="process_manager.go:497"
```

[supportbundle_8afc7ace-bbc4-45a9-9aab-aa6020b26e3b_2025-07-02T01-55-48Z.zip](https://github.com/user-attachments/files/21009955/supportbundle_8afc7ace-bbc4-45a9-9aab-aa6020b26e3b_2025-07-02T01-55-48Z.zip)

@c3y1huang Could you help check if there's anything missing here? Thank you!

**Comment by c3y1huang** [comment]
> While testing this feature based on refined terraform scripts from [longhorn/longhorn-tests#2606](https://github.com/longhorn/longhorn-tests/pull/2606), and run the test case `test_engine_live_upgrade` or manually run the following test steps:
> 
> 1. Create `ipv6` k3s cluster:
> 
> ```
> $ kubectl get nodes -owide
> NAME            STATUS   ROLES                  AGE   VERSION        INTERNAL-IP                               EXTERNAL-IP   OS-IMAGE                              KERNEL-VERSION               CONTAINER-RUNTIME
> ip-10-0-1-178   Ready    <none>                 20s   v1.33.0+k3s1   2600:1f18:51dd:4600:c40e:b9d4:14e4:3233   <none>        SUSE Linux Enterprise Server 15 SP6   6.4.0-150600.23.47-default   containerd://2.0.4-k3s4
> ip-10-0-1-191   Ready    <none>                 19s   v1.33.0+k3s1   2600:1f18:51dd:4600:9702:c182:848:adbd    <none>        SUSE Linux Enterprise Server 15 SP6   6.4.0-150600.23.47-default   containerd://2.0.4-k3s4
> ip-10-0-1-232   Ready    <none>                 18s   v1.33.0+k3s1   2600:1f18:51dd:4600:e02d:3312:8268:59bc   <none>        SUSE Linux Enterprise Server 15 SP6   6.4.0-150600.23.47-default   containerd://2.0.4-k3s4
> ip-10-0-1-72    Ready    control-plane,master   27s   v1.33.0+k3s1   2600:1f18:51dd:4600:fe88:d8c0:e199:d627   <none>        SUSE Linux Enterprise Server 15 SP6   6.4.0-150600.23.47-default   containerd://2.0.4-k3s4
> ```
> 
> 2. Install Longhorn:
> 
> ```
> $ kubectl get pods -n longhorn-system -owide
> NAME                                                READY   STATUS    RESTARTS       AGE     IP                NODE            NOMINATED NODE   READINESS GATES
> csi-attacher-5d68b48d9-6d6m8                        1/1     Running   0              58s     fd00:10:0:3::b    ip-10-0-1-232   <none>           <none>
> csi-attacher-5d68b48d9-fcwl8                        1/1     Running   0              58s     fd00:10:0:1::c    ip-10-0-1-178   <none>           <none>
> csi-attacher-5d68b48d9-hssd7                        1/1     Running   0              58s     fd00:10:0:2::a    ip-10-0-1-191   <none>           <none>
> csi-provisioner-6fcc6478db-fkgch                    1/1     Running   0              58s     fd00:10:0:2::b    ip-10-0-1-191   <none>           <none>
> csi-provisioner-6fcc6478db-l7t96                    1/1     Running   0              58s     fd00:10:0:1::d    ip-10-0-1-178   <none>           <none>
> csi-provisioner-6fcc6478db-zmpk8                    1/1     Running   0              58s     fd00:10:0:3::a    ip-10-0-1-232   <none>           <none>
> csi-resizer-6c558c9fbc-h78pq                        1/1     Running   0              58s     fd00:10:0:1::f    ip-10-0-1-178   <none>           <none>
> csi-resizer-6c558c9fbc-mgfkm                        1/1     Running   0              58s     fd00:10:0:2::c    ip-10-0-1-191   <none>           <none>
> csi-resizer-6c558c9fbc-s6dsk                        1/1     Running   0              58s     fd00:10:0:3::d    ip-10-0-1-232   <none>           <none>
> csi-snapshotter-874b9f887-5hjqb                     1/1     Running   0              58s     fd00:10:0:1::e    ip-10-0-1-178   <none>           <none>
> csi-snapshotter-874b9f887-dds46                     1/1     Running   0              58s     fd00:10:0:3::c    ip-10-0-1-232   <none>           <none>
> csi-snapshotter-874b9f887-mwsf2                     1/1     Running   0              58s     fd00:10:0:2::d    ip-10-0-1-191   <none>           <none>
> engine-image-ei-b907910b-br6dw                      1/1     Running   0              117s    fd00:10:0:1::a    ip-10-0-1-178   <none>           <none>
> engine-image-ei-b907910b-c79m4                      1/1     Running   0              117s    fd00:10:0:2::7    ip-10-0-1-191   <none>           <none>
> engine-image-ei-b907910b-c895j                      1/1     Running   0              117s    fd00:10:0:3::7    ip-10-0-1-232   <none>           <none>
> instance-manager-6a55178a8f8411dc8e7c5283b57d7303   1/1     Running   0              86s     fd00:10:0:3::8    ip-10-0-1-232   <none>           <none>
> instance-manager-b73c42c69cfe8f3002324cb314f267b8   1/1     Running   0              81s     fd00:10:0:2::8    ip-10-0-1-191   <none>           <none>
> instance-manager-cde74f08b9fa944fed3f4ec36d0212c6   1/1     Running   0              88s     fd00:10:0:1::b    ip-10-0-1-178   <none>           <none>
> longhorn-csi-plugin-87ml5                           3/3     Running   0              58s     fd00:10:0:1::10   ip-10-0-1-178   <none>           <none>
> longhorn-csi-plugin-dfscn                           3/3     Running   0              58s     fd00:10:0:3::e    ip-10-0-1-232   <none>           <none>
> longhorn-csi-plugin-x5pxl                           3/3     Running   0              58s     fd00:10:0:2::e    ip-10-0-1-191   <none>           <none>
> longhorn-driver-deployer-5f44b4dc59-9sr8t           1/1     Running   0              2m16s   fd00:10:0:2::6    ip-10-0-1-191   <none>           <none>
> longhorn-manager-d8dm8                              2/2     Running   1 (2m6s ago)   2m17s   fd00:10:0:3::5    ip-10-0-1-232   <none>           <none>
> longhorn-manager-ndllx                              2/2     Running   0              2m17s   fd00:10:0:1::8    ip-10-0-1-178   <none>           <none>
> longhorn-manager-tbwfw                              2/2     Running   0              2m17s   fd00:10:0:2::5    ip-10-0-1-191   <none>           <none>
> longhorn-ui-f7ff9c74-58rtn                          1/1     Running   0              2m15s   fd00:10:0:1::9    ip-10-0-1-178   <none>           <none>
> longhorn-ui-f7ff9c74-xw298                          1/1     Running   0              2m15s   fd00:10:0:3::6    ip-10-0-1-232   <none>           <none>
> ```
> 
> 3. Create an additional engine image:
>    ![Image](https://github.com/user-attachments/assets/1cfc6262-7719-4cd6-ace9-9fce565470ce)
> 4. Create a volume with `2` replicas on `node 0` and `node 1`, and attach the volume to `node 2`:
>    ![Image](https://github.com/user-attachments/assets/b0cb769b-5f0a-4a67-9090-4df929000dfe)
> 5. Upgrade the volume to the engine image:
>    ![Image](https://github.com/user-attachments/assets/651f80a1-d2ad-4d75-9d54-10bdff78ad08)
> 6. The volume is stuck in `upgrading` indefinitely:
>    ![Image](https://github.com/user-attachments/assets/e88f2386-440a-4c39-9b8f-bada0942b649)
> 
> with error messages in `instance-manager`:
> 
> ```
> 2025-07-02T01:55:41.955213916Z time="2025-07-02T01:55:41Z" level=info msg="Connecting to remote: [fd00:10:0:1::b]:10010 (tcp)" func="remote.(*Factory).Create" file="remote.go:394"
> 2025-07-02T01:55:41.958594947Z [test-1-e-0] time="2025-07-02T01:55:41Z" level=warning msg="Failed to create backend with address tcp://[fd00:10:0:1::b]:10010" func="controller.(*Controller).Start" file="control.go:908" error="replica must be closed, cannot add in state: dirty"
> 2025-07-02T01:55:41.958637054Z time="2025-07-02T01:55:41Z" level=info msg="Connecting to remote: [fd00:10:0:3::8]:10010 (tcp)" func="remote.(*Factory).Create" file="remote.go:394"
> 2025-07-02T01:55:41.967723236Z [test-1-e-0] time="2025-07-02T01:55:41Z" level=warning msg="Failed to create backend with address tcp://[fd00:10:0:3::8]:10010" func="controller.(*Controller).Start" file="control.go:908" error="replica must be closed, cannot add in state: dirty"
> 2025-07-02T01:55:41.969557233Z [test-1-e-0] time="2025-07-02T01:55:41Z" level=info msg="Adding backend: tcp://[fd00:10:0:1::b]:10010" func="controller.(*replicator).AddBackend" file="replicator.go:58"
> 2025-07-02T01:55:41.969569205Z time="2025-07-02T01:55:41Z" level=info msg="Adding backend: tcp://[fd00:10:0:3::8]:10010" func="controller.(*replicator).AddBackend" file="replicator.go:58"
> 2025-07-02T01:55:41.969573171Z time="2025-07-02T01:55:41Z" level=error msg="no available backend due to replica error from the addresses [tcp://[fd00:10:0:1::b]:10010 tcp://[fd00:10:0:3::8]:10010]" func=cmd.startController file="controller.go:218"
> 2025-07-02T01:55:41.971187687Z [longhorn-instance-manager] time="2025-07-02T01:55:41Z" level=info msg="Process Manager: process test-1-e-0 error out, error msg: exit status 61" func="process.(*Process).Start.func1" file="process.go:70"
> 2025-07-02T01:55:41.971198055Z [longhorn-instance-manager] time="2025-07-02T01:55:41Z" level=warning msg="Process update: test-1-e-0: state error: errorMsg: exit status 61" func="process.(*Process).RPCResponse" file="process.go:115"
> 2025-07-02T01:55:41.971286892Z [longhorn-instance-manager] time="2025-07-02T01:55:41Z" level=info msg="Stop waiting for gRPC service of process test-1-e-0 to start at localhost:10005" func="process.(*GRPCHealthChecker).WaitForRunning" file="healthchecker.go:29"
> 2025-07-02T01:55:42.937165091Z [longhorn-instance-manager] time="2025-07-02T01:55:42Z" level=warning msg="Process update: test-1-e-0: state error: errorMsg: exit status 61" func="process.(*Process).RPCResponse" file="process.go:115"
> 2025-07-02T01:55:42.937197127Z [longhorn-instance-manager] time="2025-07-02T01:55:42Z" level=error msg="Process Manager: replacement process for test-1-e-0 failed to start, now in state error" func="process.(*Manager).ProcessReplace" file="process_manager.go:514"
> 2025-07-02T01:55:42.937204844Z [longhorn-instance-manager] time="2025-07-02T01:55:42Z" level=error msg="Process Manager: cleaned up the replacement process test-1-e-0 with UUID 0dd102ac-8cbd-4143-b668-2b57ed1ff996" func="process.(*Manager).ProcessReplace.func1" file="process_manager.go:497"
> ```
> 
> [supportbundle_8afc7ace-bbc4-45a9-9aab-aa6020b26e3b_2025-07-02T01-55-48Z.zip](https://github.com/user-attachments/files/21009955/supportbundle_8afc7ace-bbc4-45a9-9aab-aa6020b26e3b_2025-07-02T01-55-48Z.zip)
> 
> [@c3y1huang](https://github.com/c3y1huang) Could you help check if there's anything missing here? Thank you!

Maybe the engine image used for upgrade testing isn't from the longhorn/engine master branch? For `test_engine_live_upgrade` case, I used a custom-built image that included the feature changes.

**Comment by yangchiu** [comment]
> Maybe the engine image used for upgrade testing isn't from the longhorn/engine master branch? For `test_engine_live_upgrade` case, I used a custom-built image that included the feature changes.

Thanks for the insight! I've updated the engine test images, and the test cases now pass with the latest engine test images as expected.

**Comment by yangchiu** [comment]
Verification passed on master-head (longhorn-manager 73d4a9f). Based on https://github.com/longhorn/longhorn-tests/pull/2606 and https://github.com/longhorn/longhorn-tests/pull/2613, regression tests passed on both `ipv4` and `ipv6`:

* Full regression test results
    * Cluster network
        * amd64
            * [ipv4 s3](https://ci.longhorn.io/job/public/job/master/job/sles/job/amd64/job/longhorn-tests-sles-amd64/1256/): 371 passed, 0 failed
            * [ipv4 nfs](https://ci.longhorn.io/job/public/job/master/job/sles/job/amd64/job/longhorn-tests-sles-amd64/1266/): 367 passed, 3 flaky test cases failed
            * [ipv6 s3](https://ci.longhorn.io/job/public/job/master/job/sles/job/amd64/job/longhorn-tests-sles-amd64/1269/): 370 passed, 1 flaky test case failed
            * [ipv6 nfs](https://ci.longhorn.io/job/public/job/master/job/sles/job/amd64/job/longhorn-tests-sles-amd64/1252/): 370 passed, 0 failed
        * arm64
            * [ipv4 s3](https://ci.longhorn.io/job/public/job/master/job/sles/job/arm64/job/longhorn-tests-sles-arm64/1135/): 371 passed, 0 failed
            * [ipv4 nfs](https://ci.longhorn.io/job/public/job/master/job/sles/job/arm64/job/longhorn-tests-sles-arm64/1131/): 370 passed, 0 failed
            * [ipv6 s3](https://ci.longhorn.io/job/public/job/master/job/sles/job/arm64/job/longhorn-tests-sles-arm64/1133/): 371 passed, 0 failed
            * [ipv6 nfs](https://ci.longhorn.io/job/public/job/master/job/sles/job/arm64/job/longhorn-tests-sles-arm64/1129/): 369 passed, 0 failed
    * Storage network
        * [ipv4 s3](https://ci.longhorn.io/job/private/job/longhorn-storage-network-test/132/): 370 passed, 0 failed
        * [ipv4 nfs](https://ci.longhorn.io/job/private/job/longhorn-storage-network-test/127/): 367 passed, 2 flaky test cases failed
        * [ipv6 s3](https://ci.longhorn.io/job/private/job/longhorn-storage-network-test/119/): 371 passed, 0 failed
        * [ipv6 nfs](https://ci.longhorn.io/job/private/job/longhorn-storage-network-test/120/): 367 passed, 3 flaky test cases failed
